#CODE;ENGLISH;x
EVTTOOLTIP61101;You usurp a title from [Root.Liege.GetTitledFirstName].;x
EVTTOOLTIP61106;You give alms to the poor in the name of [Root.Liege.GetTitledFirstName].;x
EVTTOOLTIP61121;Those in court with low opinion of [Root.Liege.GetHerHim] approve.;x
EVTTOOLTIP61123;You speak with the [Root.Liege.GetTitle].;x
EVTTOOLTIP61124;You give [From.GetTitledName] your blessing.;x
EVTTOOLTIP61125;you becoming the next regent.;x
EVTTOOLTIP61126;the court appointing a new regent.;x
EVTTOOLTIP61127;you being thrown in the dungeons.;x
EVTTOOLTIP61129;[Root.Liege.Regent.GetFirstName] is thrown in the dungeons.;x
EVTTOOLTIP61145;having [Root.Liege.GetTitledFirstName] declared insane.;x
EVTTOOLTIP61146;failing to do so.;x
EVTTOOLTIP61156;stealing the throne.;x
EVTTOOLTIP61157;failing miserably.;x
EVTTOOLTIP61160;The [Root.Liege.GetTitle] is set free!;x
EVTTOOLTIP61161;A new [Root.Liege.GetTitle].;x
EVTTOOLTIP61166;Well, you gave it your best shot...;x
EVTTOOLTIP61170;Your regent is arrested.;x
EVTTOOLTIP61191;May perish in an unfortunate accident.;x
EVTTOOLTIP61192;a roof free of bird excrements.;x
EVTTOOLTIP61197;safely returning to civilization (such as it is).;x
EVTTOOLTIP61202;surviving a tragic carriage accident.;x
EVTTOOLTIP61207;not cushioning the guard's fall at your own expense.;x
EVTTOOLTIP61211;May perish in an unfortunate stabbing spree.;x
EVTTOOLTIP61212;bravely evading the dagger.;x
EVTTOOLTIP61213;Thrown into a dark cell.;x
EVTTOOLTIP61216;Regency put into question.;x
EVTTOOLTIP61217;Becomes new regent.;x
EVTTOOLTIP61219;successfully defending your regency.;x
EVTTOOLTIP61220;losing your regency to [From.GetTitledName].;x
EVTTOOLTIP61221;The challenge is issued!;x
EVTTOOLTIP61223;Challenge accepted!;x
EVTTOOLTIP61225;delivering a killing blow.;x
EVTTOOLTIP61226;inflicting a serious wound.;x
EVTTOOLTIP61227;The regent loses, is maimed.;x
EVTTOOLTIP61228;delivering a killing blow.;x
EVTTOOLTIP61229;inflicting a serious wound.;x
EVTTOOLTIP61230;spared from death.;x
EVTTOOLTIP61231;Informed of your shameful cowardice.;x
EVTTOOLTIP61232;is put out of his misery.;x
