#CODE;ENGLISH;x

EVTDESC1500;Every day, the cook chases me out of the kitchen, but not before I've stuffed myself and my pockets full of biscuits.;x
EVTDESC1501;My [GetFromRelation], [From.GetTitledFirstName] thinks I eat far too much and has declared the kitchens off limits!;x
EVTDESC1510;I had better eat with moderation, or I'll end up looking like my fat nanny...;x
EVTDESC1511;My [GetFromRelation] is worried about my health and wants me to eat more.;x
EVTDESC1520;No, you can't have them, they are mine!;x
EVTDESC1521;My [GetFromRelation] [From.GetTitledFirstName] won't have me turn into a 'mean and selfish little moneygrubber'.;x
EVTDESC1530;If you play with me I'll let you play with my toys.;x
EVTDESC1531;My [GetFromRelation] told me I should never let my lessers have what is mine... but my friend was just going to borrow some toys!;x
EVTDESC1540;I hate Latin, I hate History and I won't do my homework!;x
EVTDESC1541;My [GetFromRelation] is furious at my 'lazy nature' and will keep a closer eye on my studies from now on.;x
EVTDESC1550;I always do my homework and my chores before I go and play.;x
EVTDESC1551;My [GetFromRelation] explained to me that I am taking life far too seriously and need to relax.;x
EVTDESC1560;It's not fair, even peasant children have nicer things than I do!;x
EVTDESC1561;My [GetFromRelation] gave me a stern talking to about the deadly sin of envy.;x
EVTDESC1570;Most people have good hearts. A stranger is just a friend I have yet to meet.;x
EVTDESC1571;My [GetFromRelation] [From.GetFirstName] took me over the knee and beat me with a stick for my trusting and weak nature.;x
EVTDESC1580;That kid mocked me! I cannot be blamed for punching him in the face and giving him a nosebleed...;x
EVTDESC1581;My [GetFromRelation] [From.GetFirstName] is not pleased with my temper. [From.GetSubjectPronounCap] gave me the switch!;x
EVTDESC1590;Let the little fools whisper and snigger behind my back. I can wait... revenge is a dish best served cold.;x
EVTDESC1591;[From.GetFirstName], my [GetFromRelation], chastised me for my cold patient nature. 'Show some spirit, damn you!' [From.GetSubjectPronoun] shouted.;x
EVTDESC1600;I stand head and shoulders above the other children, and why should I pretend otherwise?;x
EVTDESC1601;Today, my [GetFromRelation] [From.GetFirstName] called me an arrogant braggart and told me the story of Icarus and Daedalus.;x
EVTDESC1610;Why show off, when everything I have, I have been given?;x
EVTDESC1611;My [GetFromRelation] [From.GetFirstName] is not impressed with my humility. 'Stand tall when you deserve it', [From.GetSubjectPronoun] explained.;x
EVTDESC1620;People are so easy to manipulate! A smile, a tear, the right inflection, and they will rush to do my bidding.;x
EVTDESC1621;My evil [GetFromRelation] [From.GetFirstName] promised that for every lie I tell, I'll get a rap from the rod.;x
EVTDESC1630;I find religion fascinating, especially when the priests talk of heathens and infidels, and how they shall be struck down!;x
EVTDESC1631;I was reading the [Root.Religion.GetScriptureName] when my [GetFromRelation] took it away, telling me to ease off and go outside and play.;x
EVTDESC1632;I find religion fascinating, especially when the Qur'an talk of heathens and infidels, and how they shall be struck down!;x
EVTDESC1640;Sometimes, people get upset by my honest opinions. 'Yes, you look fat.' 'You have a big nose.' It's just the truth!;x
EVTDESC1641;At length, my [GetFromRelation] [From.GetFirstName] lectured me on the necessity of white lies and the virtues of omission.;x
EVTDESC1650;I don't like climbing trees, I'm afraid of spiders and I won't go near the graveyard. Does that make me a craven?;x
EVTDESC1651;My [GetFromRelation] [From.GetFirstName] talked me into touching a spider today, it was icky and I squealed but didn't run away.;x
EVTDESC1660;I climb the highest trees, visit the graveyard at midnight and collect spiders and snakes.;x
EVTDESC1661;One of the snakes bit me this morning. My poor [GetFromRelation] [From.GetFirstName] cursed my recklessness and made me promise to stop messing around with vermin.;x
EVTDESC1670;I can't look a stranger in the eye without blushing or looking down.;x
EVTDESC1671;When I refused to greet the guests, my [GetFromRelation] [From.GetFirstName] spanked me and locked me in my room without dinner.;x
EVTDESC1680;Inquisitive, curious and friendly, I always am the first to greet strangers.;x
EVTDESC1681;I rushed to meet the guests and got to the hall before my [GetFromRelation] [From.GetFirstName]. For that, I earned a spanking.;x
EVTDESC1690;I'm going to be the bestest ruler ever when I grow up!;x
EVTDESC1691;My [GetFromRelation] [From.GetFirstName] must be jealous, why else would [From.GetSheHe] punish me for being ambitious?;x
EVTDESC1700;My friends dream of riches, power and fancy things, but I don't even wanna grow up!;x
EVTDESC1701;My ears are still ringing with my [GetFromRelation] [From.GetFirstName]'s harsh words. I need to grow a spine and get some ambition.;x
EVTDESC1710;I do whatever strikes my fancy. Such as smashing this fine glass goblet!;x
EVTDESC1711;My [GetFromRelation] [From.GetFirstName] took the strap to me for smashing the goblet.;x
EVTDESC1720;I always make sure the children get equal parts when the cook gives us sweetmeats, full-cream milk or anything else.;x
EVTDESC1721;My [GetFromRelation] [From.GetFirstName] chided me for my obsession with fairness, explaining that justice is simply word invented by human with too much time on their hands.;x
EVTDESC1730;People are naive fools, laughing, dancing and nodding like puppets to the false tune played by priests and noblemen. Charlatans all!;x
EVTDESC1731;The priest bored me to tears with a sermon, then told my [GetFromRelation] about my cynicism. [From.GetSubjectPronounCap] tried beating it out of me...;x
EVTDESC1732;People are naive fools, laughing, dancing and nodding like puppets to the false tune played by imams. Charlatans all!;x
EVTDESC1733;The imam's admonishment bored me to tears, then he told my [GetFromRelation] about my cynicism. [From.GetSubjectPronounCap] tried beating it out of me...;x
EVTDESC1900;I seem to be slow to talk;x
EVTDESC1901;So where does children come from?;x
EVTDESC1902;The darkness must definitely contain goblins and demon!;x
EVTDESC1903;Other children just get into fights with me.;x
EVTDESC1904;I just do not have enough things to play with.;x
EVTDESC1905;Other children talk about their mothers, but I never see my mother.;x
EVTDESC1906;I am rather lonely, the other children does not seem to want to be with me.;x
EVTDESC1907;Why must I go to school today instead of playing 'Who's afraid of the Black Knight' with my friends?;x
EVTDESC1908;I really wonder what heathens are. Maybe [Root.Guardian.GetFullName] knows?;x
EVTDESC1909;Climbing high walls, and practising sword fighting with my friends are great fun.;x
EVTDESC1910;I wonder if [Root.Religion.GetRandomGodName] does exist. Maybe [Root.Guardian.GetFullName] knows?;x
EVTDESC1911;Why do people die? Maybe [Root.Guardian.GetFullName] knows?;x
EVTDESC1912;Will I rule one day? Maybe [Root.Guardian.GetFullName] knows?;x
EVTDESC1913;Life is good, and great parties makes them even better.;x
EVTDESC1914;I do not understand why we are fighting fellow [catholic.GetName]s?;x
EVTDESC1915;I wonder why the Church is so rich, and the peasants so poor?;x
EVTDESC1916;I wonder why [Root.Guardian.GetFullName] let that peasant get away?;x
EVTDESC1917;Peasants are only good for following my commands!;x
EVTDESC1918;Deep thoughts interest me, but I would love to hear the answers to some questions.;x
EVTDESC1919;Since we all are going to die, why not enjoy life?;x
EVTDESC1920;Serving [Root.Religion.GetRandomGodName] should be our goal in life. How can I do it the best way?;x
EVTDESC1921;I snuck out again, found my slim sword Pin and began practising. I'd rather practise sword fighting with Pin than doing embroidery, but I have to watch out so none finds out and takes my sword from me...;x
EVTDESC1922;I am afraid of so many things, and every time I show my weaknesses others ridicule me for cowardness.;x
EVTDESC1923;I sneaked through the dungeons, hearing the prisoners pleading for their life and the coarse laughter from the guards. A knife lay forgotten on the floor and I brought it with me, only to realize in the daylight why it had felt so sticky...;x
EVTDESC1924;I curled up in my favorite chair with the biggest book I could find. When I heard [Root.Guardian.GetFullName] coming up the stairs I sprung from the chair but the book dragged me down and so [Root.Guardian.GetFullName] caught me.;x
EVTDESC1925;I know I am ugly, I can never be as beautiful as some of the people in the court of [Root.Guardian.GetTitledFirstName]!;x
EVTDESC1926;I always get compliments for my fair skin, my silken hair and my big eyes. They tell me I am beautiful and I should be proud of my looks.;x
EVTDESC1927;It was market day and I had persuaded [Root.Guardian.GetFullName] to let me have some money for sweetmeats. I found what I wanted but haggled all I could until the merchant gave up, laughed and handed me the sweetmeats for a lot less than what he wanted for them.;x
EVTDESC1928;Visitors arrived today and, despite their peculiar clothes, strange language and strangely colored skin, they were warmly greeted by [Root.Guardian.GetFullName]. I wanted to talk to them and find out where they came from and who they were, but I was not sure if [Root.Guardian.GetTitledFirstName] would approve.;x
EVTDESC1929;Every chance I get I practice swordfighting, often with the older men who finds it amusing to see me charging at them with all my might. They are too seasoned for me to defeat them, but practise makes perfect and one day I will be the best.;x
EVTDESC1930;I got my first kiss today! It was not quite what I had expected but rather nice anyway. Too bad [Root.Guardian.GetFullName] blundered in on us, spoiling the moment.;x
EVTDESC1931;The kitchen is warm and filled with delicious smells and even more delicious foodstuff. If I could, I would spend all my days here.;x
EVTDESC1932;The biggest tower in [Root.Location.GetName] is staggering high, but I had decided to climb all the way up, on the outside. I saw [Root.Guardian.GetFullName] in the room at the top and shouted a greeting.;x
EVTDESC1933;I don't feel too good, I am feverish and my head hurts! Can't [Root.Guardian.GetFullName] do something to rid me of this illness?;x
EVTDESC1934;I have feelings for a [Root.GetManWoman] at court, I feel happy and almost in love everytime I see [Root.GetHerHim]. I try to accept this but will others accept me?;x
EVTDESC1935;I have never had any problems making friends, to get someone to like me I can twist and turn the truth until it fits.;x
EVTDESC1965;Haha, look at that rat trying to walk with broken legs! Roly poly little rat!;x
EVTDESC1966;My ears are still ringing from the slap [From.GetTitledFirstName] gave me over that rat.;x
EVTDESC1970;Maybe the stablemaster knows more about horses than I do, I'm not that interested anymore anyway.;x
EVTDESC1980;Women do not interest me, instead I feel drawn to other men.;x
EVTDESC1985;I know I should not be drawn to other men but I can't seem to help it. Should I deny my feelings and be as the church and world wants me to be?;x
EVTDESC1986;To lie with another [Root.GetManWoman] as you would lie with a [Root.GetManWomanOpp] is sinful, forbidden and if I was to be exposed, death would be my penalty.;x
EVTDESC1990;Men do not interest me, instead I feel drawn to other women.;x
EVTDESC1991;I can run around wild and do whatever I want. Without any guardian, I set my own moral standards!;x
EVTDESC1995;I know I should not be drawn to other women but I can't seem to help it. Should I deny my feelings and be as the church and world wants me to be?;x

EVTOPTA1500;Mmm, sweets!;x
EVTOPTA1501;But I'm hungry!;x
EVTOPTA1510;Fat people are ugly;x
EVTOPTA1511;I don't want to get fat though.;x
EVTOPTA1520;My toys! Mine!;x
EVTOPTA1521;But... they are MY toys.;x
EVTOPTA1530;I'm nice;x
EVTOPTA1531;I'm confused;x
EVTOPTA1540;I'll just take a nap instead;x
EVTOPTA1541;But I'm tired!;x
EVTOPTA1550;I'm special;x
EVTOPTA1551;[From.GetSubjectPronounCap] is right!;x
EVTOPTA1560;I want what they have!;x
EVTOPTA1561;I still NEED that dress!;x
EVTOPTA1570;They all mean well;x
EVTOPTA1571;I take it back, some people are evil.;x
EVTOPTA1580;I hate him!;x
EVTOPTA1581;I hate [From.GetObjectPronoun] too!;x
EVTOPTA1590;Patience pays off;x
EVTOPTA1591;My temper is rising;x
EVTOPTA1600;It's the truth!;x
EVTOPTA1601;Pride goeth before fall;x
EVTOPTA1610;I see that clearly;x
EVTOPTA1620;Fools, all of them!;x
EVTOPTA1621;I will never lie again! Ouch...!;x
EVTOPTA1630;I want to know more!;x
EVTOPTA1631;Maybe [From.GetSubjectPronoun] is right!;x
EVTOPTA1640;I tell it as I see it;x
EVTOPTA1641;So my tongue won't turn black?;x
EVTOPTA1650;It probably does;x
EVTOPTA1651;I was brave, wasn't I?;x
EVTOPTA1660;It makes me feel alive!;x
EVTOPTA1661;Fine!;x
EVTOPTA1670;I'm a bit shy;x
EVTOPTA1671;I'm starving!;x
EVTOPTA1680;Hi, what's your name?;x
EVTOPTA1681;I hate [From.GetObjectPronoun]!;x
EVTOPTA1690;It is my right!;x
EVTOPTA1691;Mad as a hatter, [From.GetSheHe] is;x
EVTOPTA1700;I am happy with what I have;x
EVTOPTA1701;Where can I get that?;x
EVTOPTA1710;Music to my ears!;x
EVTOPTA1711;I see that it was wrong now;x
EVTOPTA1720;It has to be fair;x
EVTOPTA1721;Perhaps [From.GetSubjectPronoun] is right...;x
EVTOPTA1730;It is all pointless!;x
EVTOPTA1731;It worked;x
EVTOPTA1900;Maybe someone will notice it.;x
EVTOPTA1901;Maybe my father will tell me?;x
EVTOPTA1902;Help me!;x
EVTOPTA1903;Maybe my father notices it.;x
EVTOPTA1904;Maybe father will give me more toys.;x
EVTOPTA1905;Maybe father knows..;x
EVTOPTA1906;It is probably no big deal.;x
EVTOPTA1907;My will should count for more...;x
EVTOPTA1908;I'll ask [Root.Guardian.GetHerHim]!;x
EVTOPTA1909;[Root.Guardian.GetFullName] would surely agree!;x
EVTOPTA1910;I'll ask [Root.Guardian.GetHerHim]!;x
EVTOPTA1911;I'll go ask [Root.Guardian.GetHerHim]!;x
EVTOPTA1912;I should ask [Root.Guardian.GetHerHim]!;x
EVTOPTA1913;Maybe I should invite [Root.Guardian.GetFullName] to one of them?;x
EVTOPTA1914;Perhaps [Root.Guardian.GetFullName] knows why?;x
EVTOPTA1915;I'll go and ask [Root.Guardian.GetFullName]!;x
EVTOPTA1916;I'll go and ask [Root.Guardian.GetHerHim]!;x
EVTOPTA1917;[Root.Guardian.GetFullName] will surely agree!;x
EVTOPTA1918;[Root.Guardian.GetFullName] will help me out!;x
EVTOPTA1919;[Root.Guardian.GetFullName] will know what to do...;x
EVTOPTA1920;[Root.Guardian.GetFullName] will know what to do...;x
EVTOPTA1921;I was not careful enough, [Root.Guardian.GetFullName] saw me!;x
EVTOPTA1922;[Root.Guardian.GetFullName], please make them stop!;x
EVTOPTA1923;Ew! Blood!;x
EVTOPTA1924;Let me go! I wanna read!;x
EVTOPTA1925;Why am I not beautiful?;x
EVTOPTA1926;I am the fairest of them all!;x
EVTOPTA1927;It was a sweet deal;x
EVTOPTA1928;[Root.Guardian.GetFullName], may I talk to the visitors?;x
EVTOPTA1929;Isn't that right, [Root.Guardian.GetFullName]?;x
EVTOPTA1930;You ruined everything!;x
EVTOPTA1931;I wanna become a cook!;x
EVTOPTA1932;[Root.Guardian.GetSheHeCap] didn't look too happy;x
EVTOPTA1933;Please, help me!;x
EVTOPTA1934;Do you accept me for who I am, [Root.Guardian.GetFullName]?;x
EVTOPTA1935;It's a great skill, isn't it, [Root.Guardian.GetFullName]?;x
EVTOPTA1965;Perhaps a cat next...;x
EVTOPTA1966;I guess I deserved it;x
EVTOPTA1970;I need a new hobby. Oh, a bible!;x
EVTOPTA1980;I like them more;x
EVTOPTA1985;No!;x
EVTOPTA1986;I will be careful...;x
EVTOPTA1991;[Root.Liege.GetTitledFirstName] may have other opinions?;x

EVTOPTB1561;I still NEED that wooden sword!;x
EVTOPTB1985;Fine...;x
EVTOPTB1986;I... cannot risk it;x

EVTOOLTIP2490;[This.GetFullName] will look at my behavior.;x
EVTOOLTIP38221;[Root.Guardian.GetFullName] saw [Root.GetFirstName] practise swordfighting;x
EVTOOLTIP38222;[Root.Guardian.GetFullName] is told about [Root.GetFirstName]'s trouble;x
EVTOOLTIP38223;[Root.Guardian.GetFullName] saw [Root.GetFirstName] with the bloody knife;x
EVTOOLTIP38224;[Root.Guardian.GetFullName] caught [Root.GetFirstName] reading instead of doing [Root.GetHerHis] chores;x
EVTOOLTIP38225;[Root.Guardian.GetFullName] comforts [Root.GetFirstName];x
EVTOOLTIP38226;[Root.Guardian.GetFullName] worries about [Root.GetFirstName];x
EVTOOLTIP38227;[Root.Guardian.GetFullName] saw [Root.GetFirstName] haggle with the merchant;x
EVTOOLTIP38228;[Root.Guardian.GetFullName] responds to [Root.GetFirstName]'s question.;x
EVTOOLTIP38229;[Root.Guardian.GetFullName] approves of [Root.GetFirstName]'s swordfighting;x
EVTOOLTIP38230;[Root.Guardian.GetFullName] realizes [Root.GetFirstName] is becoming a [Root.GetManWoman];x
EVTOOLTIP38231;[Root.Guardian.GetFullName] finds [Root.GetFirstName] in the kitchen;x
EVTOOLTIP38232;[Root.Guardian.GetFullName] deals with [Root.GetFirstName]'s curiosity;x
EVTOOLTIP38233;[Root.Guardian.GetFullName] is troubled by [Root.GetFirstName]'s illness;x
EVTOOLTIP38234;[Root.Guardian.GetFullName] realizes [Root.GetFirstName] is drawn to a [Root.GetManWoman];x
EVTOOLTIP38235;[Root.Guardian.GetFullName] has something to say about [Root.GetFirstName]'s way of getting friends;x

EVTTOOLTIP38101;[Root.Guardian.GetTitledFirstName] is questioned about [Root.Religion.GetHighGodName];x
EVTTOOLTIP38102;[This.GetTitledFirstName] becomes [Root.Religion.GetName];x
# EVTTOOLTIPA38101;[Root.Guardian.GetTitledFirstName] is questioned about Allah;x
EVTTOOLTIP38210;[Root.Guardian.GetTitledFirstName] is asked about God's existence;x

EVTDESC2000;My [GetFromRelation] [From.GetFirstName] practically lives in the kitchens, the little glutton!;x
EVTDESC2010;My [GetFromRelation] [From.GetFirstName] hardly eats anything for fear of turning fat.;x
EVTDESC2020;I watched my [GetFromRelation] [From.GetFirstName] at play with another child yesterday and noticed that [From.GetSheHe] didn't want to share [From.GetHerHis] toys.;x
EVTDESC2030;My [GetFromRelation] [From.GetFirstName] is a charitable little rascal, [From.GetSheHe] just gave [From.GetHerHis] newest toy to the smith's son.;x
EVTDESC2040;My [GetFromRelation] [From.GetFirstName] is not exerting [From.GetReflexivePronoun] in [From.GetPossPronoun] studies. I am starting to despair.;x
EVTDESC2050;My [GetFromRelation] [From.GetFirstName] does [From.GetHerHis] homework and is always on time for [From.GetHerHis] lessons.;x
EVTDESC2060;I had to break up a fight between my [GetFromRelation] [From.GetFirstName] and another child today. [From.GetFirstName]'s heart is filled with envy...;x
EVTDESC2070;My [GetFromRelation] [From.GetFirstName] has a tender and loving soul, trusting everyone in the castle. I fear [From.GetSheHe] will get hurt someday.;x
EVTDESC2080;The cook complained to me about my [GetFromRelation] [From.GetFirstName]'s temper tantrums. Apparently [From.GetSubjectPronoun] punched her son in the face. Again.;x
EVTDESC2090;Patience is a virtue, but sometimes it gets on my nerves. My [GetFromRelation] [From.GetFirstName] never loses [From.GetPossPronoun] temper, always waiting patiently for a chance to retaliate.;x
EVTDESC2100;My [GetFromRelation] [From.GetTitledFirstName] is turning into an arrogant little braggart. I might have to rein [From.GetHerHim] in a bit.;x
EVTDESC2120;I caught my [GetFromRelation], [From.GetFirstName] lying to me again, straight to my face without batting an eye. I almost had an innocent servant sent to the stocks!;x
EVTDESC2110;My [GetFromRelation] [From.GetFirstName] is modest and humble, never showing off or bragging.;x
EVTDESC2130;My little [GetFromRelation] [From.GetTitledFirstName] always has [From.GetPossPronoun] nose in the scriptures, and spends all [From.GetPossPronoun] time among the priests.;x
EVTDESC2132;My little [GetFromRelation] [From.GetTitledFirstName] always has [From.GetHerHis] nose in the Qur'an, and spends all [From.GetHerHis] time among the imams.;x
EVTDESC2140;The lady almost ran me down as I entered the hall. Tearfully she told me that my [GetFromRelation] [From.GetFirstName] had insulted her again.;x
EVTDESC2150;The smallest spider makes my [GetFromRelation] [From.GetFirstName] squeal and run for cover. This has started to worry me.;x
EVTDESC2160;My [GetFromRelation] [From.GetFirstName] was bitten by a snake this morning! The brave little fool keeps seeking out danger.;x
EVTDESC2170;Every time my [GetFromRelation] [From.GetFirstName] meets a stranger, [From.GetSheHe] looks like [From.GetSheHe] might faint.;x
EVTDESC2180;When guests arrive, my [GetFromRelation] [From.GetFirstName] is the first to greet them and shower them with questions.;x
EVTDESC2190;My [GetFromRelation] [From.GetFirstName] is aiming for the stars, the ambitious little brat.;x
EVTDESC2200;My [GetFromRelation] [From.GetFirstName] lacks all passion and ambition, perfectly content with [From.GetHerHis] lot in life.;x
EVTDESC2210;[From.GetTitledFirstName] is impulsive and seems unable to tell right from wrong. What should I do with my wayward [GetFromRelation]?;x
EVTDESC2220;My [GetFromRelation] [From.GetFirstName] makes sure everyone gets exactly the same amount of whatever sweets the cook gives the children.;x
EVTDESC2230;I fear my [GetFromRelation] [From.GetFirstName] is too cynical for [From.GetHerHis] age.;x
EVTDESC2465;I caught my young ward [From.GetTitledFirstName] torturing a rat behind the stables today...;x
EVTDESC2490;We have children at the court that has no guardian handling their education. They run a risk of becoming spoiled brats.;x

EVTOPTA2000;Heh, eat and be merry child!;x
EVTOPTA2010;Temperance is a virtue!;x
EVTOPTA2020;This is how children learn thrift!;x
EVTOPTA2030;[From.GetSubjectPronounCap] is turning out well!;x
EVTOPTA2040;[From.GetSubjectPronounCap] is just dense. What can I do?;x
EVTOPTA2050;[From.GetSubjectPronounCap] has a good mentor!;x
EVTOPTA2060;The other children are just selfish;x
EVTOPTA2070;Those who love get love in return!;x
EVTOPTA2080;The kid shows spirit!;x
EVTOPTA2090;Good, I cannot abide recklessness;x
EVTOPTA2100;No, [From.GetSheHe] has reason to be proud;x
EVTOPTA2110;Quietly encourage [From.GetFirstName];x
EVTOPTA2120;Even I am impressed;x
EVTOPTA2130;Such a bright little child!;x
EVTOPTA2140;But, my dear lady, you ARE fat!;x
EVTOPTA2150;Spiders? I can't abide them either!;x
EVTOPTA2160;That's my [From.GetLadLass]!;x
EVTOPTA2170;The [From.GetLadLass] is just a bit shy;x
EVTOPTA2180;This child clearly has potential.;x
EVTOPTA2190;That is only right;x
EVTOPTA2200;It suits [From.GetHerHis] position;x
EVTOPTA2210;How about a pat on the head?;x
EVTOPTA2220;I am proud of [From.GetObjectPronoun]!;x
EVTOPTA2230;[From.GetSubjectPronounCap] is clear-sighted.;x
EVTOPTA2465;Let the [From.GetLadLass] have [From.GetPossPronoun] fun!;x
EVTOPTA2490;I guess I have to take care of it myself then.;x

EVTOPTB2000;Birch [From.GetHerHim]!;x
EVTOPTB2010;Hold up [From.GetFirstName] as an example for the court!;x
EVTOPTB2020;[From.GetSheHeCap] needs the birch!;x
EVTOPTB2030;Praise [From.GetHerHim] publicly!;x
EVTOPTB2040;Beat [From.GetHerHim] into action!;x
EVTOPTB2050;Praise [From.GetObjectPronoun] in front of the court.;x
EVTOPTB2060;Beat some respect into [From.GetHerHim]!;x
EVTOPTB2070;Show everyone how virtuous [From.GetSubjectPronoun] is.;x
EVTOPTB2080;Beat [From.GetHerHim] into being calm!;x
EVTOPTB2090;Hold up [From.GetFirstName] as an example for the court!;x
EVTOPTB2100;That will be cured by the birch.;x
EVTOPTB2110;Thank [Root.Religion.GetRandomGodName] for [From.GetFirstName]'s virtues!;x
EVTOPTB2120;With the birch, [From.GetSheHe] will speak the truth!;x
EVTOPTB2130;I will not raise a zealot!;x
EVTOPTB2140;Praise [From.GetHerHis] honesty to the court.;x
EVTOPTB2150;Some fears are good, but there are limits;x
EVTOPTB2160;Praise [From.GetHerHis] bravery to everyone!;x
EVTOPTB2170;Shyness can be cured by the birch!;x
EVTOPTB2180;Introduce [From.GetHerHim] to everyone at court!;x
EVTOPTB2190;Ambition will not serve [From.GetObjectPronoun];x
EVTOPTB2200;That will not do!;x
EVTOPTB2210;It's the strap for [From.GetObjectPronoun]!;x
EVTOPTB2220;Time to explain how the world works;x
EVTOPTB2230;Nothing the strap won't cure!;x
EVTOPTB2465;With the birch, [From.GetSheHe] will learn better!;x
EVTOPTB2490;It is not my concern...;x

EVTOPTC2000;Talk to [From.GetHerHim] about moderation.;x
EVTOPTC2010;Thank [Root.Religion.GetRandomGodName] for [From.GetFirstName]'s virtues!;x
EVTOPTC2020;[From.GetSheHeCap] needs a lecture on charity!;x
EVTOPTC2030;Thank [Root.Religion.GetRandomGodName] for [From.GetFirstName]'s virtues!;x
EVTOPTC2040;Talk to [From.GetHerHim] about being diligent;x
EVTOPTC2050;Thank [Root.Religion.GetRandomGodName] for [From.GetFirstName]'s virtues!;x
EVTOPTC2060;Talk to [From.GetHerHim] about kindness;x
EVTOPTC2070;Thank [Root.Religion.GetRandomGodName] for [From.GetFirstName]'s virtues!;x
EVTOPTC2080;Encourage [From.GetHerHim] to be more patient;x
EVTOPTC2090;Thank [Root.Religion.GetRandomGodName] for [From.GetFirstName]'s virtues!;x
EVTOPTC2100;Tell [From.GetHerHim], 'Pride goeth before fall';x
EVTOPTC2110;That's no way to get ahead!;x
EVTOPTC2120;Talk to [From.GetHerHim] about honesty;x
EVTOPTC2140;Tell [From.GetFirstName] that honesty has its bounds...;x
EVTOPTC2150;Fear is the mind killer;x
EVTOPTC2160;Caution must temper courage;x
EVTOPTC2170;Shyness is a terrible curse, I'll talk with [From.GetHerHim].;x
EVTOPTC2180;Thank [Root.Religion.GetRandomGodName] that [From.GetSubjectPronoun] isn't shy!;x
EVTOPTC2465;Talk to [From.GetHerHim] about kindness;x

EVTOPTD2000;Pray [Root.Religion.GetRandomGodName] will save [From.GetHerHim]!;x
EVTOPTD2010;[From.GetSubjectPronounCap] must learn to enjoy life!;x
EVTOPTD2020;[Root.Religion.GetRandomGodNameCap] will save [From.GetHerHim] from Hell!!!;x
EVTOPTD2030;Charity is for naive weaklings!;x
EVTOPTD2040;Pray for [From.GetHerHis] soul!;x
EVTOPTD2050;The child needs to lighten up!;x
