chapter_name_0;Feudal System;x
tut_5c_7;These troops are free to hire, but they only attack religious enemies, and they only exist around the time of crusades, so they are a bit limited. If you are defending against infidels or heretics, they have no maintenance cost either. Now, raise your personal levy and select it to continue.;x
tut_5c_8;Flanks;x
tut_5c_9;The armies are divided into three flanks, each flank can have a leader and it's own tactic. When one of the flanks win, it can join one of the other two to reinforce them. Click next to continue.;x
tut_5c_10;Tactics;x
tut_5c_11;Each flank has a commander that will choose the tactic to use. When deciding this he is considering what kind of troops he has and what kind of troops the enemy have and adapts. How good he is at this depends on his military skill. Click next to end this part.;x
tut_6a_1;War - Basic Level;x
tut_6a_2;War is the other kind of diplomacy in this game. It is an important tool to grow your realm, and to protect what is yours. Click next to continue.;x
tut_6a_3;Claims and Casus Bellis;x
tut_6a_4;For you to be able to declare war, you first need some sort of casus belli. The most common kind is to get a claim. Other methods involve plots and events, but lets focus on claims. To see where our borders go, click the independent realms and we'll continue.;x
tut_6a_5;Selecting a target;x
tut_6a_6;Søroyar to the west of Ross seems like a good target. It would be a nice addition to our border, plus his maximum numbers of levy is not very impressive. Click on the province.;x
tut_6a_7;Picking a Fight;x
tut_6a_8;After reviewing the county stats, open the council screen.;x
tut_6a_9;Picking a Fight II;x
tut_6a_10;Now let's send our chancellor out on a secret mission to fabricate claims. Click the fabricate claims button, then click on Søroyar to place the chancellor there.;x
tut_6a_10a;Job Done;x
tut_6a_10b;Now you got an event pop-up. It says you now have a claim on the county which means you can go to war over it. Read it and click 'Press the claim' to continue. ;x
tut_6a_11;Declare War;x
tut_6a_12;Now it is time to actually declare war. So click on Søroyar again. Right click the portrait to open the diplomacy menu.;x
tut_6a_13;Declare War II;x
tut_6a_14;Click on declare war. Now you'll see the casus belli we just arranged for. Click on claim Søroyar and hit send.;x
tut_6a_15;Diplomatic Map Mode;x
tut_6a_16;The diplomatic map mode shows your diplomatic relations with other realms. Make sure you have your own province selected, then go to diplomatic map mode to see who you are at war with.;x
tut_6a_17;Statistics;x
tut_6a_18;At the bottom of the screen you can see an icon. That is showing you the leader of the opposite side in any war you are engaged in. Click the icon to see how the war is coming along.;x
tut_6a_19;Warscore;x
tut_6a_20;Here you can see how individual battles went, and also the warscore percentage. Warscore is the sum of how the war is going. To be able to claim provinces you'll need to get that number up so high that they will have to agree to your demands. Click next to continue.;x
tut_6a_21;Ending a War;x
tut_6a_22;For now, lets end this war. Press offer peace.;x
tut_6a_23;Ending a War II;x
tut_6a_24;The different outcomes of a war will be discussed in the intermediate war tutorial. Since you haven't won anything yet, demanding they surrender won't work. Offer a white peace or your surrender to end this part.;x
tut_6b_1;War - Intermediate Level;x
tut_6b_2;Once you want to end a war, there are a few different outcomes. Press next to learn about them.;x
tut_6b_3;Peace outcome;x
tut_6b_4;Attacker wins. The attacker get the claimed province or title, plus prestige and a higher score.;x
tut_6b_5;Attacker loses. The attacker lose prestige which lowers the score. They also lose the claim.;x
tut_6b_6;Truce. White peace. The attacker loses prestige.;x
tut_6b_7;Press next to end this part.;x
tut_6c_1;War - Advanced Level;x
tut_6c_2;For the advanced part of war, let's discuss some finer points of warscore and de jure claims. Click next to continue.;x
tut_6c_3;Warscore;x
tut_6c_4;When at war, you will get warscore for winning a province in battle and siege. After that not much happens though. To make it easier to claim parts of a vast empire, this changes after three years though. If you hold an enemy province for more than three years, the warscore starts to rise.;x
tut_6c_5;After three years, the warscore will start to rise for just holding the province in question. This will enable you to win over a remote province that the ruler you are fighting can't or won't send troops to defend, without you having to siege all of their other provinces. Click next to continue.;x
tut_6c_6;De Jure;x
tut_6c_7;De jure is a term used to describe what is legally considered part of a landed title, even if it de facto is controlled by another ruler right now. That means that if, for example, a county is de jure considered part of your duchy, you will always have a casus belli to go to war and take it. The de jure hierarchy is static and can never change. E.g. the Kingdom of France will, de jure, always consist of the same duchies, which will consist of the same counties, etc. Click next to end this part.;x
tut_7a_1;Plots and Intrigue - Basic Level;x
tut_7a_2;Plotting allows you to pursue goals in a less confrontational way than direct war. Other people can also plot against you though, so you always need to be prepared. Click the intrigue tab to continue.;x
tut_7a_3;Window Overview;x
tut_7a_4;This is an overview of your current ambition or plot, you have a list of decisions, and towards the bottom you have three tabs.;x
tut_7a_5;Threats - People who are possible risks are listed here.;x
tut_7a_6;Prisoners - A list of people you have imprisoned, and some information on them.;x
tut_7a_7;Plots - This is where revealed plots against you are listed.;x
tut_7a_8;Click next to end this part.;x
tut_7b_1;Plots and Intrigue - Intermediate Level;x
tut_7b_2;This part will tell you about ambitions. All playable characters can select an ambition in addition to plotting devious schemes. Click your character portait to learn more.;x
tut_7b_3;Your Ambitions;x
tut_7b_4;To the left of your portait you can see a small circular button called 'Choose an Ambition'. Here you can set an ambition for your current character. Example ambitions can be to get married, to hoard up a big pile of gold, get a thousand prestige or other things like this. When you succeed with an ambition, you will also get some kind of reward, a better reward for a harder ambition of course.;x
tut_7b_5;Once you have completed an ambition, you can select a new one. Keep in mind that some of them can be really hard to obtain, so then you need to start planning ahead to be able to complete them. Click next to continue.;x
tut_7b_6;Vassal Ambitions;x
tut_7b_7;You are not the only one with ambitions, all your vassals can potentially have them too. Sometimes it will be something you can fix, sometimes not. If a character has the ambition to get married, and you arrange a marriage for them, they will like you more. They can also have ambitions you can do nothing about, or ambitions you do not want to fulfill.;x
tut_7b_8;To see a vassal's ambition, click their portrait and it will be listed above the stats. Click next to end this part.;x
tut_7c_1;Plots and Intrigue - Advanced Level;x
tut_7c_2;Plots in Crusader Kings II can help you accomplish things that might have been hard or impossible otherwise. Going to war and winning against a foe with superior firepower for example. Unlike ambitions, it is often an aggressive act towards someone else. Often secret and illegal as well. Click the intrigue tab to continue.;x
tut_7c_3;Plot Details;x
tut_7c_4;We talked about ambitions in the intermediary intrigue tutorial. Plots can also be chosen from the character portrait screen by finding a character you wish to plot against and clicking the 'Choose a Plot' button. However, because it's hard to know exactly who you would benefit from plotting against, an easier way is to use the plot selector in the intrigue screen to find interesting plots. It is a large button called 'Click to choose a plot'.;x
tut_7c_5;You can have one plot and one ambition active at any given time. If you already have a plot and want to scheme against another character, you will have to cancel your old plot first.;x
tut_7c_6;Once you have selected a plot, you will see the target to the left, which backers you have acquired in the middle and the plot power to the right. Plot power is your strength relative to the target. To invite backers and strengthen your plot power, use the plus sign in that row. It will appear when you have selected a plot. Click next to continue.;x
tut_7c_7;Two Kinds;x
tut_7c_8;There are two kinds of plots, and they use different plot power. The military ones simply rely on military might. You make sure you and your backers have more of it, then threaten to wage war against them if they do not comply. The other kind relies on intrigue power, and there it will be the relative intrigue score of both sides that comprises the plot power. Click next to end this part.;x
tut_8a_1;Religion - Basic Level;x
tut_8a_2;Religion with all that implies, can have a big impact on what happens in your game. Crusades, piety and your own religious vassals will all play their part. The church head, which will be either a Pope, Caliph or an Ecumenical Patriarch, is the religious power for each of their religions. The Pope can not just start holy wars, he is also the one who can grant you a divorce for example. Click the religion tab to continue.;x
tut_8a_3;Window Overview;x
tut_8a_4;Here you will see that you are part of the catholic church, and you can also find the pope here and see whether he likes you or not. A high moral authority is good for the church, and bad for those who oppose it.;x
tut_8a_5;If the pope has called to a crusade, that will be listed here. The bottom part of this window lists your vassal bishops and lets you appoint successors for each one of them. Click next to end this part.;x
tut_8b_1;Religion - Intermediate Level;x
tut_8b_2;This part of the tutorial will teach you about opinions, laws and crusades. Click next to continue.;x
tut_8b_3;Religious Vassals;x
tut_8b_4;Religious vassals of Catholic rulers will only give you troops and money if they have a higher opinion of you than they do of the Pope. The easiest way to assure that, is to actually appoint someone to bishop that already likes you. Click the laws tab to see how you can accomplish that.;x
tut_8b_5;Investiture;x
tut_8b_6;In the Realm tab you can find the Investiture Law. This can either be set to papal, which means the pope elects the bishops, or free, which means that you can select your bishops by yourself. The pope will not be happy of course. Click next to learn about crusades.;x
tut_8b_7;Crusades;x
tut_8b_8;What instigates a Crusade is that the Pope appoints an area that needs to be conquered in the name of the Catholic church. For him to be able to do that, it must currently be held by Muslims or Pagans. When he does this, a special Crusade war will begin which you are able to join by going to the Pope's diplomatic interactions and choosing 'Offer to Join War'.;x
tut_8b_9;If a Crusade is successful, the ruler who had the biggest impact (highest participation score) on the Catholic side of the war will be considered to have won the Crusade.;x
tut_8b_10;Should you choose to join the Crusade and manage to be the one that wins the Crusade, you will be given all the land held by the enemy in the Crusade area. You will also get piety and prestige, as well as a Crusader trait.;x
tut_8b_11;Should you join the Crusade but one of the other Catholics wins it, you will not get any land but you will still get piety and prestige, as well as the Crusader trait. Click next to end this part.;x
tut_8c_1;Religion - Advanced Level;x
tut_8c_2;If you happen to be an independent ruler and have had a really bad fallout with the pope, you can appoint an antipope. This antipope can then be used to go to war with the current pope, and if you win, you can replace the pope with your antipope. Click the religion tab to continue.;x
tut_8c_3;Antipope;x
tut_8c_4;What you need to create an antipope is: free investiture and a bishop that likes you more than the pope. As you can see here, you have a bishop. Unfortunately, he does not like you very much. Had he done that though, we could have clicked the little button to the right and made him an antipope. ;x
tut_8c_5;Once you have your very own antipope, people who like your antipope more than the pope will pay taxes to you instead, you can circumvent excommunications and you can go to war against the pope in your antipopes place. Click next to end this part.;x
tut_9b_1;The Feudal System - Basic and Intermediate Level;x
tut_9b_2;The hierarchy in Crusader Kings is strict, and those down the chain of authority provide troops and taxes to the ones above them, regulated by laws. Click next to continue.;x
tut_9b_3;Hierarchy;x
tut_9b_4;The hierarchy is divided in three sets: city, temple or castle. If your capital is city based, you are a burgher. If your capital is temple based, you are a prince-bishop. If your capital is castle based, you are a feudal lord. This matters in the laws screen, where you have two laws for each kind of ruler. More details on all ranks are available in the manual. The playable ranks are: Count/Countess -> Duke/Duchess -> King/Queen -> Emperor/Empress. Click the laws tab to continue.;x
tut_9b_5;Laws;x
tut_9b_6;In the Realm and Obligations tabs you will find laws affecting not only yourself but also how much levies and taxes your vassals provide. You will be able to customize your Realm according to your preference. Click next to end this part.;x
tut_9c_1;The Feudal System - Advanced Level;x
tut_9c_2;The changes from the previous game are two new hierarchy levels and crown laws. Click next to continue;x
tut_9c_3;The Hierarchy;x
tut_9c_4;The two new hierarchy levels are emperor/empress and baron/baroness. The emperor sits in the absolute top above kings, and this is a playable character. The barons on the other hand are towards the lower end of the scale. They are beneath counts, and they are not playable. Lets move on to the crown laws. Click the laws tab to continue.;x
tut_9c_5;Crown Laws;x
tut_9c_6;In the Realm tab you see the laws that are not related to Succession. On the top you have the laws marked with a crown, which means they are crown laws. They concern how much freedom a king or emperor has. Your vassals will be hard to convince, but if they like you enough and you have high prestige, they will pose but a minor problem.;x
tut_9c_7;The other crown law is investiture. It can be either you or the pope that appoints bishops. Either choice will have some side-effects as well, so be sure to check the tooltip before you change. Click next to end this last part of the tutorial.;x
tut_menu_0;The Feudal System;x
tut_menu_0_description;Learn about the hierarchy of titles;x
tut_menu_1;The Economy;x
tut_menu_1_description;Learn about counties, landed holding and taxation;x
tut_menu_2;The Council;x
tut_menu_2_description;Learn about the councillors and their jobs;x
tut_menu_3;Succession;x
tut_menu_3_description;Learn about inheritance, laws and dynasties;x
tut_menu_4;Diplomacy;x
tut_menu_4_description;Character opinions, traits, marriages alliances;x
tut_menu_5;Military and Combat;x
tut_menu_5_description;Learn about units, levies, mercenaries, battles and sieges;x
tut_menu_6;War;x
tut_menu_6_description;Learn about claims, casus bellis, peace outcomes and war score;x
tut_menu_7;Plots and Intrigue;x
tut_menu_7_description;Learn about ambitions, plots, revolts and the intrigue view;x
tut_menu_8;Religion;x
tut_menu_8_description;Learn about papal abilities, crusades, holy orders, investiture and antipopes;x
tut_menu_9;Introduction;x
tut_menu_9_description;This tutorial will introduce you to the most basic parts of what Crusader Kings II is and how you play it.;x
tutorial_chapter_budget_intm;End of the Intermediary Budget Tutorial;x
tutorial_chapter_council_basic;End of the basic council tutorial;x
tutorial_chapter_council_intm;End of the intermediary council tutorial;x
tutorial_chapter_diplomacy_basic;End of the basic diplomacy tutorial;x
tutorial_chapter_diplomacy_intm;End of the intermediary diplomacy tutorial;x
tutorial_chapter_economy_basic;End of the basic economy tutorial;x
tutorial_chapter_economy_intm;End of the intermediary economy tutorial;x
tutorial_chapter_end;Choose how you wish to proceed.;x
tutorial_chapter_feudal_intm;End of the intermediary feudal system tutorial;x
tutorial_chapter_introduction;End of Introduction.;x
tutorial_chapter_military_basic;End of the basic military tutorial.;x
tutorial_chapter_military_intm;End of the intermediary military tutorial.;x
tutorial_chapter_plots_basic;End of the basic plots and intrigue tutorial;x
tutorial_chapter_plots_intm;End of the intermediary plots and intrigue tutorial;x
tutorial_chapter_religion_basic;End of the basic religion tutorial;x
tutorial_chapter_religion_intm;End of the intermediary religion tutorial;x
tutorial_chapter_succession_basic;End of the basic succession tutorial;x
tutorial_chapter_succession_intm;End of the intermediary succession tutorial;x
tutorial_chapter_war_basic;End of the basic war tutorial;x
tutorial_chapter_war_intm;End of the intermediary war tutorial;x
tutorial_continue_advanced;Advanced $TYPE$;x
tutorial_continue_basic;Basic $TYPE$;x
tutorial_continue_end;Return to Menu;x
tutorial_continue_intermediary;Intermediary $TYPE$;x
tutorial_end_of_chapter;End of Tutorial Chapter;x