EVTOPTA_CM_4013;Spare me your lamentations!;x
EVTDESC_CM_4002;My [GetFromRelation], [From.GetTitledFirstName], has requested to join the Knights of the Sun in their holy mission to protect the faithful, even though this will forever disinherit him.;x
EVTDESC_CM_4013;Your Majesty, why this unreasonable enmity towards our Order? The Knights of the Sun seek only to serve [Root.Religion.GetRandomGodName] and protect the faithful! Where is your dedication to our faith?\n\nWith sadness,\n\n[From.GetTitledFirstName];x
EVTDESC_CM_4353;Most wise [Root.GetTitledFirstName], the Order needs more castles in order to train troops and generate a supporting income. It has come to my attention that there is a suitable location in your demesne - in [target_province.GetName] to be specific. I am willing to pay you 100 gold in exchange for the right to construct a fortress there.\nPeace be upon you,\n\n[target_grandmaster.GetTitledName];x
EVTDESC_CM_4010;Most righteous [Root.GetTitledFirstName], our Order needs more castles in order to train troops and generate a supporting income. It has come to my attention that there is a suitable location in your demesne - in [target_province.GetName] to be specific. I am willing to pay you 100 gold in exchange for the right to construct a fortress there.\n\nIn His light,\n\n[target_grandmaster.GetTitledFirstName];x
EVTDESC_CM_4324;The Haruriyyah have constructed a castle in [Root.GetName]!;x
EVTDESC_CM_4011;The Knights of the Sun have constructed a castle in [Root.GetName]!;x
EVTDESC_CM_4399;Your Highness, this extremely generous donation will not be forgotten. You have my friendship, as well as that of the Priesthood. Rest assured that you will be rewarded in Heaven, if not on Earth!\nPraise [Root.Religion.GetRandomGodName],\n\n[target_grandmaster.GetTitledFirstName];x
EVTDESC_CM_4006;Great [Root.PrimaryTitle.GetRulerTitle], your extremely generous donation will aid us greatly as we ride into battle against the enemies of [Root.Religion.GetRandomGodName]! May His light always shine upon you and illuminate your being!\n\nFor the Knights of the Sun,\n\n[target_grandmaster.GetTitledFirstName];x
EVTOPTA_CM_4399;Praised be [Root.Religion.GetRandomGodName].;x
EVTTITLE_CM_4000;The Knights of the Sun;x
EVTTITLE_CM_4309;The Haruriyyah;x
EVTDESC_CM_4000;A new holy order has been founded for the defense and preservation of the reformed and expanding Zunist religion. They call themselves 'Knights of the Sun' and are sworn to stand steadfast in battle, protect the faithful and help spread the light of Zun the Justice-Giver to new lands. Many young warriors are already flocking to their golden standard.;x
EVTOPTA_CM_4000;Praise [target_grandmaster.Religion.GetRandomGodName]!;x
EVTDESC_CM_4309;A new order of Muslim warriors has been founded, claiming descent from the old Haruri traditions and swearing to protect Islam and combat infidels and polytheists of all kinds. It was a Haruri who killed the Caliph Ali with a poisoned sword since they saw him as corrupting Islam, and this new group now vows to show the same courage and detemination in fighting any enemies of the true faith. They call themselves simply 'The Haruriyyah'.;x
EVTDESC_CM_4311;Most righteous [Root.GetTitledFirstName], of course we, the Haruriyyah, can lend you 300 gold. All that we ask in return is your future assistance in certain matters as they might arise. Salaam alaykum,\n\n[target_grandmaster.GetTitledName];x
EVTDESC_CM_4323;Great [Root.GetTitledFirstName], the Order needs more castles in order to train recruits and generate a supporting income. I am willing to cancel your debt to us if you will simply allow us to build a castle in [target_province.GetName]. Peace be with you,\n\n[target_grandmaster.GetTitledName];x
EVTDESC_CM_4331;My [GetFromRelation], [From.GetTitledFirstName], has requested to join the Haruriyyah to fight the infidel! This will forever disinherit him and he will never disgrace the dynasty with his decadence.;x
EVTDESC_CM_4303;Peace be upon you, most magnificent [Root.GetTitledFirstName]. As you may know, our order is in need of leaders, and, considering your debt to us, I would like to request that your able and noble son [demanded_child.GetFirstName] serve in our ranks. Naturally, this would disinherit him. Allah be with you,\n\n[From.GetTitledName];x
EVTOPTA_CM_4309;I am sure we can make use of them.;x
EVTOPTB_CM_4309;Poisoned swords? Hmm...;x
EVTTOOLTIP_CM_4003;[This.GetTitledFirstName] becomes a Knight of the Sun.;x
EVTTOOLTIP_CM_4332;[This.GetTitledFirstName] becomes a member of the Haruriyyah Order;x

EVTDESC_SOA_1003;Most righteous [Root.GetTitledFirstName], I have a humble request for you in light of your debt to us. There is no rest in our defense against the infidel and we have desperate need of knights to lead our men. Thus, I would like to extend this opportunity to your able and noble son [demanded_child.GetFirstName] to serve in our ranks. Naturally, this would disinherit him. Sincerely Yours in Christ,\n\nGrand Master [demanding_grandmaster.GetFirstName];x
EVTDESC_SOA_1011;Most virtuous [Root.GetTitledFirstName], of course we, the Poor Fellow-Soldiers of Christ and of the Temple of Solomon, can lend you 300 gold. All that we ask in return is your future assistance in certain matters as they might arise. Pax Christi,\n\nGrand Master [target_grandmaster.GetFirstName];x
EVTDESC_SOA_1016;My liege, the Poor Fellow-Soldiers of Christ and of the Temple of Solomon stand ready to serve you in defense of Christianity and the Holy Land! Pax Christi,\n\nGrand Master [target_grandmaster.GetFirstName];x
EVTDESC_SOA_1023;My dear [Root.GetTitledFirstName], the Order needs more castles in order to train troops and generate a supporting income. I am willing to cancel your debt to us if you will simply allow us to build a castle in [target_province.GetName]. Pax Christi,\n\nGrand Master [target_grandmaster.GetFirstName];x
EVTDESC_SOA_1024;The Knights Templar have constructed a castle in [Root.GetName]!;x
EVTDESC_SOA_1031;My [GetFromRelation], [From.GetTitledFirstName], has requested to join the Knights Templar in their struggle against the infidel, even though this will forever disinherit him.;x
EVTDESC_SOA_1053;Most righteous [Root.GetTitledFirstName], the Order needs more castles in order to train troops and generate a supporting income. It has come to my attention that there is a suitable location in your demesne - in [target_province.GetName] to be specific. I am willing to pay you 100 gold in exchange for the right to construct a fortress there.\nPax Christi,\n\nGrand Master [target_grandmaster.GetFirstName];x
EVTDESC_SOA_1054;The Knights Templar have constructed a castle in [Root.GetName]!;x
EVTDESC_SOA_1061;Your majesty, this antagonism is completely unwarranted! The Order serves Christ, but, one has to wonder, do you?\n\nWith anger and sadness,\n\nGrand Master [target_grandmaster.GetFirstName];x
EVTDESC_SOA_1116;My liege, the Order of Saint John - the Knights Hospitaller - stands ready to serve you in defense of Christianity and the Holy Land! Pax Christi,\n\nGrand Master [target_grandmaster.GetFirstName];x
EVTDESC_SOA_1131;My [GetFromRelation], [From.GetTitledFirstName], has requested to join the Knights Hospitaller in their struggle against the infidel, even though this will forever disinherit him.;x
EVTDESC_SOA_1141;Your Highness, this extremely generous donation will not be forgotten. You have my friendship, as well as that of the Church. Rest assured that you will be rewarded in Heaven, if not on Earth!\nPax Christi,\n\nGrand Master [target_grandmaster.GetFirstName];x
EVTDESC_SOA_1153;Most righteous [Root.GetTitledFirstName], the Order needs more castles in order to defend Christianity against the Infidel. It has come to my attention that there is a suitable location in your demesne - in [target_province.GetName] to be specific. I am willing to pay you 100 gold in exchange for the right to construct a fortress there.\nPax Christi,\n\nGrand Master [target_grandmaster.GetFirstName];x
EVTDESC_SOA_1154;The Knights Hospitaller have constructed a castle in [Root.GetName]!;x
EVTDESC_SOA_1203;Peace be upon you, most magnificent [Root.GetTitledFirstName]. As you may know, our order is in need of leaders, and, considering your debt to us, I would like to request that your able and noble son [demanded_child.GetFirstName] serve in our ranks. Naturally, this would disinherit him. Allah be with you,\n\nGrand Master [demanding_grandmaster.GetFirstName];x
EVTDESC_SOA_1209;A Sufi sect of dervishes has arisen under the leadership of a certain Hadji Baktash Wali, a mystic from Khorasan. Striving for 'Unity of Being', Bektashis train the soul through meditation and contemplation of the inner meaning of the Koran. The Bektashi Order is warlike and especially popular among [Root.Religion.GetName] Muslim soldiers. The Order has sworn to protect Islam and to combat infidels and polytheists of all kinds.;x
EVTDESC_SOA_1211;Most righteous [Root.GetTitledFirstName], of course we, the Bektashi Order, can lend you 300 gold. All that we ask in return is your future assistance in certain matters as they might arise. Salaam alaykum,\n\nGrand Master [target_grandmaster.GetFirstName];x
EVTDESC_SOA_1223;Great [Root.GetTitledFirstName], the Order needs more castles in order to train recruits and generate a supporting income. I am willing to cancel your debt to us if you will simply allow us to build a castle in [target_province.GetName]. Peace be with you,\n\nGrand Master [target_grandmaster.GetFirstName];x
EVTDESC_SOA_1224;The Bektashi Order have constructed a castle in [Root.GetName]!;x
EVTDESC_SOA_1231;My [GetFromRelation], [From.GetTitledFirstName], has requested to join the Bektashi Order to fight the infidel! This will forever disinherit him and he will never disgrace the dynasty with his decadence.;x
EVTDESC_SOA_1253;Most wise [Root.GetTitledFirstName], the Order needs more castles in order to train troops and generate a supporting income. It has come to my attention that there is a suitable location in your demesne - in [target_province.GetName] to be specific. I am willing to pay you 100 gold in exchange for the right to construct a fortress there.\nPeace be upon you,\n\nGrand Master [target_grandmaster.GetFirstName];x
EVTDESC_SOA_1331;My [GetFromRelation], [From.GetTitledFirstName], has requested to join the Teutonic Order in their struggle against the heathens, even though this will forever disinherit him.;x
EVTDESC_SOA_1353;Most righteous [Root.GetTitledFirstName], the Order needs more castles in order to defend Christianity against the vicious heathens. It has come to my attention that there is a suitable location in your demesne - in [target_province.GetName] to be specific. I am willing to pay you 100 gold in exchange for the right to construct a fortress there.\nPax Christi,\n\nGrand Master [From.GetFirstName];x
EVTDESC_SOA_1354;The Teutonic Order have constructed a castle in [Root.GetName]!;x
EVTDESC_SOA_1411;Most righteous [Root.GetTitledFirstName], of course we, the Nizari Ismailis, can lend you 300 gold. All that we ask in return is your future assistance in certain matters as they might arise. Salaam alaykum,\n\nGrand Master [target_grandmaster.GetFirstName];x
EVTDESC_SOA_1424;The Nizari Ismaili Hashshashins have constructed a castle in [Root.GetName]!;x
EVTDESC_SOA_1431;My [GetFromRelation], [From.GetTitledFirstName], has requested to join the dreaded Hashshashins in their shady struggles. This will forever disinherit him and he will never disgrace the dynasty with his decadence.;x
EVTDESC_SOA_1454;The Hashshashins have constructed a castle in [Root.GetName]!;x
EVTDESC_SOA_1461;Great [Root.PrimaryTitle.GetRulerTitle], your antagonism is misguided! The Order serves Allah, but, one has to wonder, do you?\n\nWith furious anger,\n\nGrand Master [From.GetFirstName];x
EVTDESC_SOA_1531;My [GetFromRelation], [From.GetTitledFirstName], has requested to join the fearsome Jomsvikings in their adventures, even though this will forever disinherit him.;x
EVTDESC_SOA_1541;Great [Root.PrimaryTitle.GetRulerTitle], your extremely generous donation will aid us greatly in our fight for the glory of the Old Gods! You have my friendship, as well as that of both gods and priesthood. May the gods smile on you.\nFor the Allfather!\n\nWarchief [target_grandmaster.GetFirstName];x
EVTDESC_SOA_1553;Mighty [Root.GetTitledFirstName], the Jomsviking brotherhood has need of another base from which to strike at the weak followers of the lesser gods. I understand that there is a suitable location in your demesne, in [target_province.GetName]. I am willing to pay you 100 gold in exchange for the right to construct a fortress there.\nGlory to Odin!\n\nWarchief [target_grandmaster.GetFirstName];x
EVTDESC_SOA_1554;The Jomsvikings have constructed a castle in [Root.GetName]!;x
EVTDESC_SOA_1561;Great [Root.PrimaryTitle.GetRulerTitle], your wrath is misdirected! The Order serves the gods faithfully, but, one has to wonder, do you?\n\n[From.Religion.GetRandomGodNameCap] curse you!,\n\nWarchief [From.GetFirstName];x
EVTDESC_SOA_1609;The Brotherhood has worked tirelessly to protect Christian holy sites and relics in the Holy Land ever since it was first founded in 313, when the Edict of Milan legalized Christendom throughout the Roman Empire. Until recently, the Brotherhood consisted of ordained clergy who maintained and safeguarded these religious sites through largely peaceful means.\n\nAs the winds of change sweep across the world, this holy order has now become increasingly militarized and their ranks have grown dramatically to include professional soldiers as well. They have reaffirmed their dedication to protect the Holy Land from heathen invaders, but this pledge has now extended to include the defense of all of Orthodox Christendom.;x
EVTDESC_SOA_1631;My [GetFromRelation], [From.GetTitledFirstName], has requested to join the Brotherhood of the Holy Sepulchre in their struggle against the infidel, even though this will forever disinherit him.;x
EVTDESC_SOA_1653;Most righteous [Root.GetTitledFirstName], the Brotherhood needs more castles in order to train troops and generate a supporting income. It has come to my attention that there is a suitable location in your demesne - in [target_province.GetName] to be specific. I am willing to pay you 100 gold in exchange for the right to construct a fortress there.\nPax Christi,\n\nGrand Master [target_grandmaster.GetFirstName];x
EVTDESC_SOA_1654;The Brotherhood of the Holy Sepulchre has constructed a castle in [Root.GetName]!;x
EVTDESC_SOA_1661;Your majesty, this antagonism is completely unwarranted! The Brotherhood serves Christ, but, one has to wonder, do you?\n\nWith anger and sadness,\n\nGrand Master [From.GetFirstName];x
EVTDESC_SOA_1709;The Knights of Saint Anthony come from one of the oldest chivalric orders in the world. In 370, disciples of Anthony the Hermit founded the Order of Saint Anthony under the patronage of the Emperor of Ethiopia.\n\nAlthough they have kept a low profile for many centuries, this holy order has now resurfaced as a powerful force. Their stated purpose is to protect [Root.Religion.GetName] Christians from all those who would seek them harm, and to purge the land of infidels and heretics wherever they may be found.;x
EVTDESC_SOA_1731;My [GetFromRelation], [From.GetTitledFirstName], has requested to join the Order of Saint Anthony in their struggle against the infidel, even though this will forever disinherit him.;x
EVTDESC_SOA_1754;The Order of Saint Anthony has constructed a castle in [Root.GetName]!;x
EVTDESC_SOA_1809;Some of Persia's finest warriors have taken it upon themselves to found a new holy order dedicated to safeguarding the [Root.Religion.GetName] faith. They call themselves the Immortals, just like the ancient Persian warrior elite described by Herodotus, and they seem intent on carrying on the martial traditions of their legendary predecessors.\n\nThis militant holy order has sworn to fight against all who would threaten the legacy of Zoroaster, and to never again allow Zoroastrianism to suffer the reverses it did in the wake of the Arab conquests of the 7th century.;x
EVTDESC_SOA_1831;My [GetFromRelation], [From.GetTitledFirstName], has requested to join the Immortals in their struggle against the infidel, even though this will forever disinherit him.;x
EVTDESC_SOA_1841;Great [Root.PrimaryTitle.GetRulerTitle], your extremely generous donation will aid us greatly in our continued defense of the [Root.Religion.GetName] faithful! You have my friendship, as well as that of the priesthood.\n\nBy Zoroaster's will,\nGrand Master [target_grandmaster.GetFirstName];x
EVTDESC_SOA_1853;Most righteous [Root.GetTitledFirstName], the Immortals need more castles in order to train troops and generate a supporting income. It has come to my attention that there is a suitable location in your demesne - in [target_province.GetName] to be specific. I am willing to pay you 100 gold in exchange for the right to construct a fortress there.\n\nBy Zoroaster's will,\nGrand Master [target_grandmaster.GetFirstName];x
EVTDESC_SOA_1854;The Immortals have constructed a castle in [Root.GetName]!;x
EVTDESC_SOA_1861;Your majesty, this antagonism is completely unwarranted! The Immortals carry on the work of the prophet Zoroaster, but, one has to wonder, do you?\n\nWith anger and sadness,\n\nGrand Master [From.GetFirstName];x
EVTDESC_SOA_1909;The Third Temple now stands tall on Temple Mount in Jerusalem, and several pious Jews have formed a new holy order modelled after the ancient Zealots to protect Judaism against its enemies. Just like the Jewish sect that is their namesake, these new Zealots will not shy away from violence against those they feel are deserving.\n\nSome within the Jewish religious community have accused the Zealots of taking their faith to extreme levels, but the ranks of this new order continue to swell as Jewish exiles returning to the Promised Land flock to their banner. Their numbers now include everyone from uneducated peasants to veteran soldiers from distant European wars.;x
EVTDESC_SOA_1931;My [GetFromRelation], [From.GetTitledFirstName], has requested to join the Zealots in their struggle against the infidel, even though this will forever disinherit him.;x
EVTDESC_SOA_1941;Great [Root.PrimaryTitle.GetRulerTitle], your extremely generous donation will aid us greatly in our continued defense of Jerusalem, the Third Temple and the [Root.Religion.GetName] faith! You have my friendship, as well as that of the priesthood.\n\nRemember Masada!\nGrand Master [target_grandmaster.GetFirstName];x
EVTDESC_SOA_1953;Most righteous [Root.GetTitledFirstName], the Zealots need more castles in order to train troops and generate a supporting income. It has come to my attention that there is a suitable location in your demesne - in [target_province.GetName] to be specific. I am willing to pay you 100 gold in exchange for the right to construct a fortress there.\n\nRemember Masada!\nGrand Master [target_grandmaster.GetFirstName];x
EVTDESC_SOA_1954;The Zealots have constructed a castle in [Root.GetName]!;x
EVTDESC_SOA_1961;Your majesty, this antagonism is completely unwarranted! The Zealots seek only to defend Judaism from its many enemies, but, one has to wonder, do you?\n\nWith anger and sadness,\n\nGrand Master [From.GetFirstName];x
EVTDESC_SOA_2009;The mighty Sky-Father of the Tengri faith is all-seeing, but still has need of human instruments on the ground. The Lords of the Sky, a new holy order that has been founded in the wake of the Tengri Reformation, ride to do battle against infidels and to spread the will of the Sky-Father to all corners of the world. The deafening sound of these knights approaching on their mounts is like thunder in the sky, and the noise alone is rumored to have made some convert to the Tengri religion on the spot.;x
EVTDESC_SOA_2031;My [GetFromRelation], [From.GetTitledFirstName], has requested to join the Lords of the Sky in their tireless pursuit of heathenry, even though this will forever disinherit him.;x
EVTDESC_SOA_2041;Great [Root.PrimaryTitle.GetRulerTitle], your extremely generous donation will aid us greatly as we ride into battle against the enemies of the Sky-Father! Upon my honor, I shall name one of my finest steeds after you!\n\nFor the Sky-Father!\nWarchief [target_grandmaster.GetFirstName];x
EVTDESC_SOA_2053;Most righteous [Root.GetTitledFirstName], the Lords of the Sky are in need of more castles in order to train troops and generate a supporting income. There is a suitable location in your demesne - in [target_province.GetName] to be specific. I am willing to pay you 100 gold in exchange for the right to construct a fortress there.\n\nFor the Sky-Father!\nWarchief [target_grandmaster.GetFirstName];x
EVTDESC_SOA_2054;The Lords of the Sky have constructed a castle in [Root.GetName]!;x
EVTDESC_SOA_2061;Your majesty, this antagonism is completely unwarranted! The Lords of the Sky seek only to ride into battle against the enemies of the Sky-Father. Can you make that same claim?\n\nWith anger and sadness,\n\nWarchief [From.GetFirstName];x
EVTDESC_SOA_2109;With the reformation of the many African pagan belief systems into a single coherent whole, several tribes have agreed to pool together their best warriors into a single holy order. They claim to be the Guardians of the Spirits and they have vowed to defend the spirits and those who believe in them from all who would do them harm.;x
EVTDESC_SOA_2131;My [GetFromRelation], [From.GetTitledFirstName], has requested to join the Spirit Guardians in their brave defense of our faith, even though this will forever disinherit him.;x
EVTDESC_SOA_2141;Great [Root.PrimaryTitle.GetRulerTitle], your extremely generous donation shall aid us greatly in our unceasing efforts to defend the Spirits and their faithful believers! You have my friendship, as well as that of the priesthood.\n\nMay the Spirits walk with you,\nWarchief [target_grandmaster.GetFirstName];x
EVTDESC_SOA_2153;Most righteous [Root.GetTitledFirstName], the Spirit Guardians are in need of more castles in order to train troops and generate a supporting income. There is a suitable location in your demesne - in [target_province.GetName] to be specific. I am willing to pay you 100 gold in exchange for the right to construct a fortress there.\n\nMay the Spirits walk with you,\nWarchief [target_grandmaster.GetFirstName];x
EVTDESC_SOA_2154;The Spirit Guardians have constructed a castle in [Root.GetName]!;x
EVTDESC_SOA_2161;Your majesty, this antagonism is completely unwarranted! The Spirit Guardians walk with the Spirits and are prepared to give their lives to defend them, but, one has to wonder, are you?\n\nWith anger and sadness,\n\nWarchief [From.GetFirstName];x
EVTDESC_SOA_2209;The Slavic faith has been reformed and this has led to a religious fervor throughout the lands of the Slavs the likes of which has never been seen before. Many of the greatest champions have come together to form a new Slavic holy order. They call themselves the Warriors of Perun, the god of thunder, and have all taken vows to defend the Slavic faith and its believers to their dying breaths.;x
EVTDESC_SOA_2231;My [GetFromRelation], [From.GetTitledFirstName], has requested to join the Warriors of Perun in their heroic deeds to smite the enemies of the gods, even though this will forever disinherit him.;x
EVTDESC_SOA_2241;Great [Root.PrimaryTitle.GetRulerTitle], your extremely generous donation shall aid us greatly in our quest to serve the will of Perun! You have my friendship, as well as that of the priesthood.\n\nMay Perun watch over you,\nWarchief [target_grandmaster.GetFirstName];x
EVTDESC_SOA_2253;Most righteous [Root.GetTitledFirstName], the Warriors of Perun are in need of more castles in order to train troops and generate a supporting income. There is a suitable location in your demesne - in [target_province.GetName] to be specific. I am willing to pay you 100 gold in exchange for the right to construct a fortress there.\n\nMay Perun watch over you,\nWarchief [target_grandmaster.GetFirstName];x
EVTDESC_SOA_2254;The Warriors of Perun have constructed a castle in [Root.GetName]!;x
EVTDESC_SOA_2261;Your majesty, this antagonism is completely unwarranted! The Warriors of Perun serve at the pleasure of the gods, but, one has to wonder, do you?\n\nWith anger and sadness,\n\nWarchief [From.GetFirstName];x
EVTDESC_SOA_2309;Perkunas, the god of thunder, has spoken! As the Romuvan religion reforms to better face the modern world, several champions have stepped forward, claiming that Perkunas has willed them to found a new holy order. The Chosen of Perkunas, as they call themselves, have sworn to defend the Romuvan faith and to direct the wrath of the gods towards the skulls of their enemies.;x
EVTDESC_SOA_2331;My [GetFromRelation], [From.GetTitledFirstName], has requested to join the Chosen of Perkunas in their war against unbelievers, even though this will forever disinherit him.;x
EVTDESC_SOA_2341;Great [Root.PrimaryTitle.GetRulerTitle], your extremely generous donation shall aid us greatly in our quest to serve the will of Perkunas! You have my friendship, as well as that of the priesthood.\n\nMay Perkunas watch over you,\nWarchief [target_grandmaster.GetFirstName];x
EVTDESC_SOA_2353;Most righteous [Root.GetTitledFirstName], the Chosen of Perkunas are in need of more castles in order to train troops and generate a supporting income. There is a suitable location in your demesne - in [target_province.GetName] to be specific. I am willing to pay you 100 gold in exchange for the right to construct a fortress there.\n\nMay Perkunas watch over you,\nWarchief [target_grandmaster.GetFirstName];x
EVTDESC_SOA_2354;The Chosen of Perkunas have constructed a castle in [Root.GetName]!;x
