EVTDESC_SOA_2361;Your majesty, this antagonism is completely unwarranted! The Chosen of Perkunas serve at the pleasure of the gods, but, one has to wonder, do you?\n\nWith anger and sadness,\n\nWarchief [From.GetFirstName];x
EVTDESC_SOA_2409;A new Finnish holy order has surfaced dedicated to the preservation and defense of the new reformed Suomenusko religion. These warriors call themselves the 'Sons of Kaleva' and they are prepared to march into battle against all those who would deny the truth of their faith. Many Finns look upon them as the heroes of their ancient myths, and they seem to have no shortage of recruits.;x
EVTDESC_SOA_2431;My [GetFromRelation], [From.GetTitledFirstName], has requested to join the heroes in the Sons of Kaleva in struggle against heathens, even though this will forever disinherit him.;x
EVTDESC_SOA_2441;Great [Root.PrimaryTitle.GetRulerTitle], your extremely generous donation shall aid us greatly in our quest to serve the will of Kaleva! You have my friendship, as well as that of the priesthood.\n\nMay the Gods watch over you,\nWarchief [target_grandmaster.GetFirstName];x
EVTDESC_SOA_2453;Most righteous [Root.GetTitledFirstName], the Sons of Kaleva are in need of more castles in order to train troops and generate a supporting income. There is a suitable location in your demesne - in [target_province.GetName] to be specific. I am willing to pay you 100 gold in exchange for the right to construct a fortress there.\n\nMay the Gods watch over you,\nWarchief [target_grandmaster.GetFirstName];x
EVTDESC_SOA_2454;The Sons of Kaleva have constructed a castle in [Root.GetName]!;x
EVTDESC_SOA_2461;Your majesty, this antagonism is completely unwarranted! The Sons of Kaleva serve at the pleasure of the gods, but, one has to wonder, do you?\n\nWith anger and sadness,\n\nWarchief [From.GetFirstName];x
EVTDESC_SOA_2509;The Easterners across the sea have more religions than a parrot has feathers, but the Aztec faith has now been reformed and reorganized to better stand against the heathens. Several warrior-priests have also founded a new holy order: the Cult of Huitzilopochtli. Devoted to the Aztec deity of war, this cult is bent on the forceful conversion of the world – preferably with lots of human sacrifice in the process.;x
EVTDESC_SOA_2531;My [GetFromRelation], [From.GetTitledFirstName], has requested to join the Cult of Huitzilopochtli in their ongoing efforts to rip the heart out of every heathen unbeliever, even though this will forever disinherit him.;x
EVTDESC_SOA_2541;Great [Root.PrimaryTitle.GetRulerTitle], your extremely generous donation shall aid us greatly in organizing the sacrifice rituals that Huitzilopochtli demand! You have my friendship, as well as that of the priesthood.\n\nHuitzilopochtli's faithful servant,\nHigh Priest [target_grandmaster.GetFirstName];x
EVTDESC_SOA_2553;Most righteous [Root.GetTitledFirstName], the Cult of Huitzilopochtli are in need of more castles in order to train troops and generate a supporting income. There is a suitable location in your demesne - in [target_province.GetName] to be specific. I am willing to pay you 100 gold in exchange for the right to construct a fortress there.\n\nHuitzilopochtli's faithful servant,\nHigh Priest [target_grandmaster.GetFirstName];x
EVTDESC_SOA_2554;The Cult of Huitzilopochtli has constructed a castle in [Root.GetName]!;x
EVTDESC_SOA_2561;Your majesty, this antagonism is completely unwarranted! The Cult of Huitzilopochtli serve the will of Huitzilopochtli, but, one has to wonder, do you?\n\nWith anger and sadness,\n\nHigh Priest [From.GetFirstName];x
EVTDESC_SOA_2609;This chivalric order owes its name to Santiago Matamoros, or Saint James the Moorslayer as he is known in other parts of the world. The Order of Santiago enjoys the official sponsorship of the [Root.Religion.GetName] Church and its knights have all sworn to purge entire realms of heathens and heretics if so requested by a [Root.Religion.GetName] ruler.;x
EVTDESC_SOA_2631;My [GetFromRelation], [From.GetTitledFirstName], has requested to join the Knights of Santiago in their struggle against the infidel, even though this will forever disinherit him.;x
EVTDESC_SOA_2653;Most righteous [Root.GetTitledFirstName], the Knights of Santiago need more castles in order to train troops and generate a supporting income. There is a suitable location in your demesne - in [target_province.GetName] to be specific. I am willing to pay you 100 gold in exchange for the right to construct a fortress there.\n\nPax Christi,\nGrand Master [target_grandmaster.GetFirstName];x
EVTDESC_SOA_2654;The Knights of Santiago have constructed a castle in [Root.GetName]!;x
EVTDESC_SOA_2661;Your majesty, this antagonism is completely unwarranted! The Knights of Santiago serve Christ, but, one has to wonder, do you?\nWith anger and sadness,\n\nGrand Master [From.GetFirstName];x
EVTDESC_SOA_2709;The Order of Calatrava is the most recent addition to the soldiers of the Cross, having just been endorsed in a decree issued by the [Root.Religion.GetName] Church. These knights take their name from a castle recovered in Iberia from the clutches of the Moslem infidel, and they stand ready to combat heathens and defend the pious in the name of any [Root.Religion.GetName] ruler who is willing to provide for their upkeep.;x
EVTDESC_SOA_2731;My [GetFromRelation], [From.GetTitledFirstName], has requested to join the Knights of Calatrava in their struggle against the infidel, even though this will forever disinherit him.;x
EVTDESC_SOA_2753;Most righteous [Root.GetTitledFirstName], the Knights of Calatrava need more castles in order to train troops and generate a supporting income. There is a suitable location in your demesne - in [target_province.GetName] to be specific. I am willing to pay you 100 gold in exchange for the right to construct a fortress there.\n\nPax Christi,\nGrand Master [target_grandmaster.GetFirstName];x
EVTDESC_SOA_2754;The Knights of Calatrava have constructed a castle in [Root.GetName]!;x
EVTDESC_SOA_2761;Your majesty, this antagonism is completely unwarranted! The Knights of Calatrava serve Christ, but, one has to wonder, do you?\n\nWith anger and sadness,\nGrand Master [From.GetFirstName];x
EVTDESC_SOA_2809;The imperative to protect the Holy Places for Nestorian Christianity has caused the Catholicos, [Root.RelHead.GetTitledName], to declare the creation of a holy brotherhood of warrior monks - the Order of Saint Addai, named after the apostle who spread Christianity to Syria and Mesopotamia. They stand ready to smite heathens and infidels and protect the righteous in the name of any [Root.Religion.GetName] ruler who is willing to provide for their upkeep.;x
EVTDESC_SOA_2831;My [GetFromRelation], [From.GetTitledFirstName], has requested to join the Order of Saint Addai in their struggle against the infidel, even though this will forever disinherit him.;x
EVTDESC_SOA_2853;Most righteous [Root.GetTitledFirstName], the Order of Saint Addai needs more castles in order to train troops and generate a supporting income. There is a suitable location in your demesne - in [target_province.GetName] to be specific. I am willing to pay you 100 gold in exchange for the right to construct a fortress there.\n\nPax Christi,\nGrand Master [target_grandmaster.GetFirstName];x
EVTDESC_SOA_2854;The Order of Saint Addai has constructed a castle in [Root.GetName]!;x
EVTDESC_SOA_2861;Your majesty, this antagonism is completely unwarranted! The Order of Saint Addai serve Christ, but, one has to wonder, do you?\n\nWith anger and sadness,\nGrand Master [From.GetFirstName];x
EVTDESC_SoA_2862;My husband, [demanded_child.GetName], has gone off to join [demanded_child.Liege.PrimaryTitle.GetName]. This effectively annuls our marriage...;x
EVTDESC_SoA_2863;My husband, [FromFrom.GetName], has gone off to join [FromFrom.Liege.PrimaryTitle.GetName]. This effectively annuls our marriage...;x
EVTDESC_SOA_2990;I can expel the Holy Order to finally be rid of them from my realm! But I must be sure of this. Once expelled, I will not be able to allow them back.;x

EVTOPTA_SOA_1003;Very well, it's a good life;x
EVTOPTA_SOA_1023;A reasonable request;x
EVTOPTA_SOA_1024;Impressive!;x
EVTOPTA_SOA_1031;Go with my blessing.;x
EVTOPTA_SOA_1209;They could be useful...;x
EVTOPTA_SOA_1609;A laudable goal!;x
EVTOPTA_SOA_1709;These knights can finally fulfill their vows.;x
EVTOPTA_SOA_1809;The legendary warriors have returned!;x
EVTOPTA_SOA_1909;Any defense of Judaism is welcome.;x
EVTOPTA_SOA_2009;Let them ride forward in the name of the Sky-Father!;x
EVTOPTA_SOA_2109;The Spirits be praised!;x
EVTOPTA_SOA_2209;May the enemies of Perun quake in their boots!;x
EVTOPTA_SOA_2309;Like a thunderbolt, they shall strike down their foes!;x
EVTOPTA_SOA_2409;They are like the heroes of myth!;x
EVTOPTA_SOA_2509;May their sacrifices be many and gruesome.;x
EVTOPTA_SOA_2609;Brave warriors of Christ!;x
EVTOPTA_SOA_2709;May their battles end in victory!;x
EVTOPTA_SOA_2990;Drive them all out!;x

EVTOPTB_SOA_1003;Pay them back instead;x
EVTOPTB_SOA_1031;Absolutely not!;x
EVTOPTB_SOA_1061;Good Riddance!;x
EVTOPTB_SOA_1153;No, that region is mine;x
EVTOPTB_SOA_1209;Mystic Soldiers? Pah!;x
EVTOPTB_SOA_1353;No, that region is mine;x
EVTOPTB_SOA_1553;No, that region is mine;x
EVTOPTB_SOA_1609;These clerics should stay in their monestaries.;x
EVTOPTB_SOA_1709;Saint who?;x
EVTOPTB_SOA_1809;Immortals? Pah, relics of the past.;x
EVTOPTB_SOA_1909;Radicals and extremists, the whole lot!;x
EVTOPTB_SOA_2009;What will these barbarians think of next?;x
EVTOPTB_SOA_2609;Worrying...;x
EVTOPTB_SOA_2709;More sheep to the slaughter!;x
EVTOPTB_SOA_2990;I'll permit them to stay. For now.;x

EVTOPTC_SOA_1003;Never!;x

EVTTITLE_SOA_1209;The Bektashi Order;x
EVTTITLE_SOA_1609;Brotherhood of the Holy Sepulchre;x
EVTTITLE_SOA_1709;The Order of Saint Anthony;x
EVTTITLE_SOA_1809;The Immortals;x
EVTTITLE_SOA_1909;The Zealots;x
EVTTITLE_SOA_2009;The Lords of the Sky;x
EVTTITLE_SOA_2109;The Spirit Guardians;x
EVTTITLE_SOA_2209;The Warriors of Perun;x
EVTTITLE_SOA_2309;The Chosen of Perkunas;x
EVTTITLE_SOA_2409;The Sons of Kaleva;x
EVTTITLE_SOA_2509;The Cult of Huitzilopochtli;x
EVTTITLE_SOA_2609;The Knights of Santiago;x
EVTTITLE_SOA_2709;The Knights of Calatrava;x
EVTTITLE_SOA_2809;The Order of Saint Addai;x

EVTTOOLTIP_SOA_1032;[From.GetTitledFirstName] becomes a Knight Templar.;x
EVTTOOLTIP_SOA_1033;[From.GetTitledFirstName] is disappointed.;x
EVTTOOLTIP_SOA_1132;[From.GetTitledFirstName] becomes a Knight Hospitaller.;x
EVTTOOLTIP_SOA_1232;[From.GetTitledFirstName] joins the Bektashi Order.;x
EVTTOOLTIP_SOA_1332;[From.GetTitledFirstName] joins the Teutonic Order.;x
EVTTOOLTIP_SOA_1432;[From.GetTitledFirstName] joins the Hashshashins.;x
EVTTOOLTIP_SOA_1532;[From.GetTitledFirstName] becomes a Jomsviking.;x
EVTTOOLTIP_SOA_1632;[From.GetTitledFirstName] becomes a member of the Brotherhood.;x
EVTTOOLTIP_SOA_1732;[From.GetTitledFirstName] becomes a Knight of Saint Anthony.;x
EVTTOOLTIP_SOA_1832;[From.GetTitledFirstName] becomes an Immortal.;x
EVTTOOLTIP_SOA_1932;[From.GetTitledFirstName] becomes a Zealot.;x
EVTTOOLTIP_SOA_2032;[From.GetTitledFirstName] becomes a Sky Lord.;x
EVTTOOLTIP_SOA_2132;[From.GetTitledFirstName] becomes a Spirit Guardian.;x
EVTTOOLTIP_SOA_2232;[From.GetTitledFirstName] becomes a Warrior of Perun.;x
EVTTOOLTIP_SOA_2332;[From.GetTitledFirstName] becomes a Chosen of Perkunas.;x
EVTTOOLTIP_SOA_2432;[From.GetTitledFirstName] becomes a Son of Kaleva.;x
EVTTOOLTIP_SOA_2532;[From.GetTitledFirstName] becomes a member of the Cult of Huitzilopochtli.;x
EVTTOOLTIP_SOA_2632;[From.GetTitledFirstName] becomes a Knight of Santiago.;x
EVTTOOLTIP_SOA_2732;[From.GetTitledFirstName] becomes a Knight of Calatrava.;x
EVTTOOLTIP_SOA_2832;[From.GetTitledFirstName] becomes a Knight of Saint Addai.;x

HOLY_ORDER_BORROW_ALT;Most virtuous [Root.GetTitledFirstName], of course we can lend you 300 gold. All that we ask in return is your future assistance in certain matters as they might arise. May [target_grandmaster.Religion.GetHighGodName] bless you,\n\nGrand Master [target_grandmaster.GetFirstName];x
HOLY_ORDER_BUILD_CASTLE_ALT;My dear [Root.GetTitledFirstName], the Order needs more castles in order to train troops and generate a supporting income. I am willing to cancel your debt to us if you will simply allow us to build a castle in [target_province.GetName]. May [target_grandmaster.Religion.GetHighGodName] bless you,\n\nGrand Master [target_grandmaster.GetFirstName];x
HOLY_ORDER_BUILD_CASTLE_FOR_MONEY_ALT;Most righteous [Root.GetTitledFirstName], the Order needs more castles in order to train troops and generate a supporting income. It has come to my attention that there is a suitable location in your demesne - in [FromFrom.GetName] to be specific. I am willing to pay you 100 gold in exchange for the right to construct a fortress there.\nMay [From.Religion.GetHighGodName] bless you,\n\nGrand Master [From.GetFirstName];x
HOLY_ORDER_CONSTRUCTION_COMPLETE_ALT;The Holy Order has constructed a castle in [Root.GetName]!;x
HOLY_ORDER_DEMAND_SON_ALT;Most righteous [Root.GetTitledFirstName], I have a humble request for you in light of your debt to us. There is no rest in our defense against the infidel and we have desperate need of knights to lead our men. Thus, I would like to extend this opportunity to your able and noble son [demanded_child.GetFirstName] to serve in our ranks. Naturally, this would disinherit him. May [target_grandmaster.Religion.GetHighGodName] bless you,\n\nGrand Master [target_grandmaster.GetFirstName];x
HOLY_ORDER_DONATE_MONEY_ALT;Your Highness, this extremely generous donation will not be forgotten. You have my friendship, as well as that of the Church. Rest assured that you will be rewarded in the Afterlife, if not on Earth!\nMay [target_grandmaster.Religion.GetHighGodName] bless you,\n\nGrand Master [target_grandmaster.GetFirstName];x
HOLY_ORDER_EXPEL_ALT;Your majesty, this antagonism is completely unwarranted! The Order serves [target_grandmaster.Religion.GetHighGodName], but, one has to wonder, do you?\n\nWith anger and sadness,\n\nGrand Master [target_grandmaster.GetFirstName];x

expelling_holy_order_decision_tooltip_b;Expel the Holy Order from the realm.;x
expelling_holy_order_event_tooltip_a;Expel the Holy Order and confiscate any land they have within the realm;x
expelling_holy_order_event_tooltip_b;Allow the Holy Order to remain within the realm;x
PAGAN_HOLY_ORDER_FORMED_ALT;In the wake of the recent reformation a new Holy Order has been born. Hundreds of zealots already flock to its banners, ready to do war in defense of their faith.;x
