EVTDESC_HL_8005_brother;Without any heirs of his own, it falls on you to take your brother to the mountains. He will be offered to the birds of prey and in death he will generously share his flesh with all living creatures. May his spirit soar into the heavens.;x
EVTDESC_HL_8005_father;As your father's heir, it falls on you to take him to the mountains. He will be offered to the birds of prey and in death he will generously share his flesh with all living creatures. May his spirit soar into the heavens.;x
EVTDESC_HL_8005_mother;As your mother's heir it falls upon you to bring her to the mountains. She will be offered to the birds of prey, and in death she will generously share her flesh with all living creatures. May her spirit soar into the heavens.;x
EVTDESC_HL_8005_other;As per custom, you should take your predecessor to the mountains. They will be offered to the birds of prey and in death they will generously share their flesh with all living creatures. May their spirit soar into the heavens.;x
EVTDESC_HL_8005_sister;Without any heirs of her own, it falls upon you to bring your sister to the mountains. She will be offered to the birds of prey, and in death she will generously share her flesh with all living creatures. May her spirit soar into the heavens.;x
EVTDESC_HL_8006;On your way towards the mountains your party runs into a small storm with heavy rain. The rain makes the earth soft and the air cold.;x
EVTDESC_HL_8008;On your way to the mountains, you encounter a lonely hermit. He doesn't own much besides a worn down tent, an old and sick horse, along with a few sheep. But the old man invites you to drink some salted tea with him. As you talk, you realize that you are enjoying his company!;x
EVTDESC_HL_8010;After reaching the mountains, you carefully place the body in what you deem a good location. You can already hear the vultures soaring above as you perform the necessary rituals. When you start to make your way back down, it doesn't take long until the vultures begin to tear at the flesh with both beak and claw.;x
EVTDESC_HL_8011;Ever since you left the mountains, you have had the odd feeling that someone is following you. But when you turn to look, there is nothing there. But as you reach the top of a small hill, you quickly turn your head and see that one of the vultures has been following you! And not just any vulture. It's a bearded vulture!;x
EVTDESC_HL_8020;You have selected a remote and secluded location for the tomb. The men are ready and waiting for your command to start digging.;x
EVTDESC_HL_8022;The tomb stand completed. It sparkles with all the gold and steel within. You make sure to properly seal and cover the tomb, taking extra caution to make sure that no markings reveals its location. You kill all the workers so that no one but you, and your personal guard, know where to find it.;x
EVTDESC_HL_8030;The days have been agonizingly warm. Your water has almost run out. The body has already started to decompose and can be smelled from quite the distance. Yet, you haven't reached the place where the death worm is rumored to exist. The others of your party beg you to go back.;x
EVTDESC_HL_8032;Finally reaching the area where the olgoi-khorkhoi are supposedly found, you feel satisfied with your achievement. You see no sign of the worm, but you are sure that it lurkers just beneath the sands! You place the body on the ground, or what's left of it, to be sacrificed to the mighty creature.;x
EVTDESC_HL_8035;It was a difficult journey, but you made it home safely. Most of your party perished in the desert, and it seems that you alone were able to complete the journey without severely straining your health.;x

EVTNAME_HL_8005;Sky Burial;x
EVTNAME_HL_8006;Bad Weather;x
EVTNAME_HL_8008;A Lone Hermit;x
EVTNAME_HL_8010;Sky Burial;x
EVTNAME_HL_8011;Being Followed;x
EVTNAME_HL_8020;Constructing Tomb;x
EVTNAME_HL_8022;Golden Tomb;x
EVTNAME_HL_8030;The Gobi Desert;x
EVTNAME_HL_8032;The Gobi Desert;x
EVTNAME_HL_8035;Home at Last;x

EVTOPTA_HL_8005;I shall take him to the mountains myself.;x
EVTOPTA_HL_8006;Let us find shelter until it passes.;x
EVTOPTA_HL_8008;Here. Take this.;x
EVTOPTA_HL_8010;You are with [Root.Religion.GetRandomGodName] now.;x
EVTOPTA_HL_8011;Can I keep it?!;x
EVTOPTA_HL_8020;Well then. Put your back into it!;x
EVTOPTA_HL_8022;Magnificent, and no one shall ever disturb it.;x
EVTOPTA_HL_8030;Nonsense! We must continue!;x
EVTOPTA_HL_8032;A worthy burial! Now to get back home..;x
EVTOPTA_HL_8032_custom_tooltip;safely reaching home.;x
EVTOPTA_HL_8035;What doesn't kill you makes you stronger!;x

EVTOPTB_HL_8005;No. He shall have a golden tomb worthy of his name.;x
EVTOPTB_HL_8006;A little rain has never killed anyone!;x
EVTOPTB_HL_8008;Why don't you join us?;x
EVTOPTB_HL_8011;Just scare it away.;x
EVTOPTB_HL_8022;Have the guards killed as well.;x
EVTOPTB_HL_8030;This was a bad idea.. Lets go back..;x
EVTOPTB_HL_8032;That was fun! But now, I must rest.. right here..;x

EVTOPTC_HL_8005;He shall not be eaten by birds, but by olgoi-khorkhoi!;x
EVTOPTC_HL_8005_custom_tooltip_a;A sky burial is prepared.;x
EVTOPTC_HL_8005_custom_tooltip_b;The construction of a mighty tomb begins.;x
EVTOPTC_HL_8005_custom_tooltip_c;It will be a difficult journey across the desert. Greatly risking your life. Those with health concerns would likely perish..;x
EVTOPTC_HL_8008;Thank you, but I must be going.;x

EVTDESC_HL_9000;You and your men are practicing wrestling when you notice a crowd starting to form around you. Wrestling is an honored tradition that keeps nomad warriors fit for war, but ever so often it happens that training sessions turn into competitive spectacles. Your men have already started putting on a show for the crowd. They beckon you to join them.;x
EVTDESC_HL_9001;With matches lasting upwards of two hours, Bökh wrestling is an excellent way to prove your endurance. You and your opponent are expected to dance as you enter and leave the contest field, and it's also expected of the winner to help the opponent up off the ground as the match is over. You know that this will require you to exert yourself to your very limit.;x
EVTDESC_HL_9003;The crowd cheers as you and your opponent dance into the contest field. After circling for a while you charge in, locking yourself with the opposing wrestler. After several minutes of furious grappling you spot a weakness in your opponent's defense. You quickly let go of his upper body and grab his legs, tipping him over. He falls over and his elbows touch the ground – you are the victor!;x
EVTDESC_HL_9004;The crowd cheers as you and your opponent dance into the contest field. After circling for a while you charge in, locking yourself with the opposing wrestler. After several minutes of furious grappling you start to feel the strain. Suddenly your opponent catches you off guard and grabs your legs. He lifts you into the air and lets you fall to the ground. You've been defeated!;x

EVTOPTA_HL_9000;I can't disappoint the audience, now can I?;x
EVTOPTA_HL_9001;I'll challenge one of my greatest warriors!;x
EVTOPTA_HL_9003;My opponent was pathetic, I won't help him up!;x
EVTOPTA_HL_9004;Maybe this wasn't such a good idea after all...;x

EVTOPTB_HL_9000;There's no time for this, get back to training the lot of you!;x
EVTOPTB_HL_9001;Naturally, I expect whoever I challenge to yield.;x
EVTOPTB_HL_9003;I have triumphed! Now take my hand, I'll help you up.;x
EVTOPTB_HL_9004;I was bested fair and square, my opponent is truly worthy!;x

EVTOPTC_HL_9001;On the other hand, this seems dangerous...;x
EVTOPTC_HL_9003;I may have won, but we'll share the glory!;x
EVTOPTC_HL_9004;You dare defeat the Khan? Now feel my wrath!;x

EVTOPTD_HL_9000;You can have your fun, but I'll sit this one out...;x
EVTOPTD_HL_9001;I'll challenge my trusty steed, Glitterhoof!;x
EVTOPTD_HL_9003;That was a thrilling experience! Meet me in my tent later?;x
EVTOPTD_HL_9004;I may have lost, but it was a thrilling experience!;x

EVTTOOLTIP_HL_9000A;You decide to join the contest.;x
EVTTOOLTIP_HL_9001A;Is challenged to a wrestling match!;x
