EVTDSC_RIP_21000_FALLBACK;With age comes wisdom, they say. "Or at least, it may change the questions we ask", you mutter to yourself. You have had trouble sleeping lately - more often than not, while the rest of your court is sound asleep, you find yourself staring at the ceiling. You are getting older, each day closer to leaving this plane of existence. It is folly to fear such things, of course, yet you cannot keep these feelings at bay. Didn't you use to dream of grander things? What about you carving your own path? What happened to your ambitions?\n\nYou sit up straight in your bed. This is ridiculous. You are the ruler! You have people ready to serve your any whim! Perhaps your councilors have ideas? If nothing else, it might ease your trouble sleeping.;x
EVTDSC_RIP_21000_MARRIED;With age comes wisdom, they say. "Or at least, it may change the questions we ask", you mutter to yourself. You have had trouble sleeping lately - more often than not, while the rest of your court is sound asleep, you find yourself staring at the ceiling. You are getting older, each day closer to leaving this plane of existence. It is folly to fear such things, of course, yet you cannot keep these feelings at bay. You want more days with [Root.Spouse.GetFirstName], your family...!\n\nYou sit up straight in your bed. This is ridiculous. You are the ruler! You have people ready to serve your any whim! Perhaps your councilors have ideas? If nothing else, it might ease your trouble sleeping.;x
EVTDSC_RIP_21000_MARRIED_NO_LOVE;With age comes wisdom, they say. "Or at least, it may change the questions we ask", you mutter to yourself. You have had trouble sleeping lately - more often than not, while the rest of your court is sound asleep, you find yourself staring at the ceiling. You are getting older, each day closer to leaving this plane of existence. It is folly to fear such things, of course, yet you cannot keep these feelings at bay. Didn't you use to dream of... more? What about you and [Root.Spouse.GetTitledFirstName]? What happened to love?\n\nYou sit up straight in your bed. This is ridiculous. You are the ruler! You have people ready to serve your any whim! Perhaps your councilors have ideas? If nothing else, it might ease your trouble sleeping.;x
EVTDSC_RIP_21000_UNMARRIED;With age comes wisdom, they say. "Or at least, it may change the questions we ask", you mutter to yourself. You have had trouble sleeping lately - more often than not, while the rest of your court is sound asleep, you find yourself staring at the ceiling. You are getting older, each day closer to leaving this plane of existence. It is folly of course, yet you are terrified you'll end up all alone, like the miserable [eternal_life_sad_example.GetTitledFirstName]... You've seen [eternal_life_sad_example.GetHerHim] skulking about, a dark cloud over [eternal_life_sad_example.GetHerHim]...\n\nYou sit up straight in your bed. This is ridiculous. You are the [Root.GetTitle]! You have [Root.Religion.GetHighGodName] on your side! Maybe your councilors could calm you down? If nothing else, it might ease your trouble sleeping.;x
EVTDSC_RIP_21000_UNMARRIED_AMBITIOUS;With age comes wisdom, they say. "Or at least, it may change the questions we ask", you mutter to yourself. You have had trouble sleeping lately - more often than not, while the rest of your court is sound asleep, you find yourself staring at the ceiling. You are getting older, each day closer to leaving this plane of existence. It is folly to fear such things, of course, yet you cannot keep these feelings at bay. Didn't you use to dream of grander things? What about you carving your own path? What happened to your ambitions?\n\nYou sit up straight in your bed. This is ridiculous. You are the ruler! You have people ready to serve your any whim! Perhaps your councilors have ideas? If nothing else, it might ease your trouble sleeping.;x
EVTDSC_RIP_21001;Your council convenes and the faces of your advisors speak of confusion. "Why are we here, my [Root.GetLordLady]?" It comes with a hint of concern. You sit down and the suspense is almost tangible, as you leave the question hanging in the air. Finally you speak and without disclosing much of your current nightly restlessness, you convey the message eloquently enough... \n\n"I want to discuss the concept of life and death. And... I want to look into everlasting life." They nod, slowly. "So what do you think?" \n\nThe spirit rises in the room as your councillors start to talk, some hesitantly, some gesturing wildly. They all have ideas.;x
EVTDSC_RIP_21006;You asked several people in your court, and even waited for a long time for some of them to get back to you, but none of them have heard of a method to avoid the whole mess of dying. You reckon it's a lot like sleeping though? You probably shouldn't worry about it.;x
EVTDSC_RIP_21007;Several months have passed since you put out your request regarding knowledge on increased lifespans. However, no one has come forward and your council has grown increasingly indifferent about the issue. You are starting to wonder whether the knowledge exists at all? If it does, is it maybe not meant to be found? You still have trouble sleeping.\n\nYou will return to your normal life, you suppose, cherishing whatever days you have left. The sun sets, and it rises again. Who knows for how long you will rise with it?;x
EVTDSC_RIP_21008;As per your orders your [Root.GetChancellorName] [Root.job_chancellor.GetTitledFirstName] has been corresponding with all the important scholarly nobles of the known world. Some of them have been intrigued by the enquiries put forward. Others have been skeptical, while some have been outright dismissive. However, a select few have been relaying mysterious rumors from the north, stories sounding nothing short of magic. \n\n[Root.job_chancellor.GetFirstName] informs you that one contact in particular is worried about the repercussions if it became known that they have been entertaining these borderline heretic ideas. "It pains me to say, my [Root.GetLordLady], but this sort of gossip does not come for free" [Root.job_chancellor.GetSheHe] says, brows furrowed. "I may be a diplomat, but I'm not a hypnotist.";x
EVTDSC_RIP_21009;I'm not going to say I believe the stories, but we have picked up some promising information, my [Root.GetLordLady] [eternal_life_advisor.GetTitledFirstName] says. "However, we could do with some more supplies if we are to journey even further. In fact, I would like to send word to hire scouts in certain more distant regions, if we are to follow the leads and continue this... Mission." [eternal_life_advisor.GetSheHeCap] pauses at the door, [eternal_life_advisor.GetHerHis] posture strained. "Of course, there are other ways to reach eternity," [eternal_life_advisor.GetSheHe] sighs. When you open your mouth to respond, indignantly, [eternal_life_advisor.GetSheHe] interrupts you: "I suppose the attitude comes with the job, [Root.GetMasterMistress]. My apologies."\n\n Your [Root.GetMarshalName] exits the room, [eternal_life_advisor.GetHerHis] steps growing fainter as you consider your options...;x
EVTDSC_RIP_21010;Your [Root.GetSpymasterName] finds you in the night, startling you awake. "Sorry, [Root.GetMasterMistress], but the walls have ears. I dared not come during the day" [eternal_life_advisor.GetSheHe] says. "Somebody is on my track, I could use some help throwing them off my scent. No no, don't worry, it means that we're getting close", [eternal_life_advisor.GetSheHe] whispers, a confident smirk only just visible on [eternal_life_advisor.GetHerHis] face.\n\n"There's a legend, you see, and... Well, we're very close to locating a certain person who can help, but we're not the only ones looking for her...";x
EVTDSC_RIP_21011;When you check up on [eternal_life_advisor.GetTitledFirstName] to inquire about the search, you find [eternal_life_advisor.GetHerHim] slumped over [eternal_life_advisor.GetHerHis] books, sound asleep. You clear your throat loudly and [eternal_life_advisor.GetSheHe] sits up straight, drowsy eyes darting panickedly around the room, before suppressing a yawn. \n\n"Sorry, [Root.GetMasterMistress], I must've dozed off. Truth be told, I am starting to give up... To make it through all these scriptures, I think I need an assistant. Or ten." [eternal_life_advisor.GetSheHeCap] rolls [eternal_life_advisor.GetHerHis] eyes, then looks down, abashedly. "I'm sorry, my [Root.GetLordLady], I'll make do, of course.";x
EVTDSC_RIP_21013_CHANCELLOR;Your [Root.GetChancellorName] [eternal_life_advisor.GetFirstName] is beaming. "You know how [eternal_life_random_diplomat.GetTitledFirstName] can be, I had to make sure that it was [eternal_life_random_diplomat.GetHerHis] son who mentioned it first and then it was easy to make it seem [eternal_life_random_diplomat.GetHerHis] idea in the first place and, well... I won't bore you with ALL the details" [eternal_life_advisor.GetSheHe] says, clearly excited to have something noteworthy to tell you. When you roll your eyes for the third time [eternal_life_advisor.GetSheHe] finally pulls it together and skips to the part about a mystic woman, allegedly traveling the whole world, strange wonders following her footsteps. \n\n"Oh, [Root.GetMasterMistress], I think you should invite her here," [eternal_life_advisor.GetSheHe] urges.;x
EVTDSC_RIP_21013_MARSHAL;Your [Root.GetMarshalName] [eternal_life_advisor.GetFirstName] looks lost for words. "[Root.GetMasterMistressCap], I am not sure what to think". [eternal_life_advisor.GetSheHeCap] shakes [eternal_life_advisor.GetHerHis] head as [eternal_life_advisor.GetSheHe] searches for the correct way to phrase [eternal_life_advisor.GetHerselfHimself]. "My [Root.GetTitle], she is... impressive. I can't quite put my finger on it. Not to mention she has traveled far." [eternal_life_advisor.GetHerHisCap] face conveys uncertainty and [eternal_life_advisor.GetSheHe] shifts [eternal_life_advisor.GetHerHis] weight. "I see", you say, scratching your head.\n\n[eternal_life_advisor.GetFirstName] breaks the silence: "My [Root.GetLordLady], I can still send her away. What say you?";x
EVTDSC_RIP_21013_SPIRITUAL;Your court [Root.Religion.GetPriestTitle] [eternal_life_advisor.GetFirstName] hesitantly leads you to his chamber. "This is... Highly unorthodox, my [Root.GetMasterMistress]. But I assure you, all our research points to the lady you are about to meet. She has traveled a long way, from the distant lands in the East, to come and see you. A quite remarkable lady, if I say so myself..." \n\nYou ask [eternal_life_advisor.GetTitledFirstName] about this mysterious woman and her teachings, but [eternal_life_advisor.GetSheHe] avoids your questions and insists that it will be better if you ask her yourself.;x
EVTDSC_RIP_21013_SPYMASTER;You are almost used to your [Root.GetSpymasterName] [eternal_life_advisor.GetFirstName] visiting your chambers at the strangest hours, but you still jump when [eternal_life_advisor.GetSheHe] steps out from the shadows one evening. "It wasn't easy, but we got something, my [Root.GetLordLady]," [eternal_life_advisor.GetSheHe] says calmly, as if clandestine meetings had become the norm for social interaction. You compose yourself before asking "what?", your voice not quite concealing your irritation.\n\nPerhaps you were foolish to investigate eternal life? You could be setting yourself up to be duped, or so the whispers go. \n\n"There's a mystic. She... is something else" [eternal_life_advisor.GetFirstName] says, interrupting your thoughts. "Should I bring her to you?";x
EVTDSC_RIP_21014;A stranger has appeared at your court. "She says she will only speak to you, my [Root.GetLordLady]," a servant bows before you, clearly annoyed. You pause. What is this about? The times are busy in [Root.Capital.GetName] and you were in the middle of contemplating whether you should have a grand feast thrown in your name or arrange for a prestigious hunting trip. There is always someone to impress, and you would rather not get involved in the drama of the court. You glance at the servant, still bowing deeply. Very well...\n\nIn the main hall a hooded figure approaches you.;x
EVTDSC_RIP_21017;In spite of all [eternal_life_advisor.GetHerHis] efforts [eternal_life_advisor.GetTitledFirstName]'s search for information on how to prolong the life of [eternal_life_advisor.GetHerHis] [Root.GetMasterMistress] has turned up fruitless. Disappointment is written all over your face as you rise to leave the council meeting. [eternal_life_advisor.GetSheHeCap] avoids your gaze for months, but [eternal_life_advisor.GetSheHe]'s not the only one. Whenever you enter the room nowadays people grow quiet. \n\nThe rumor says you're dying. In a sense it is true, but aren't we all? You still have trouble sleeping. \n\nWas life always this awkward?;x
EVTDSC_RIP_21019_DIPLOMACY_A;You expected a wrinkled old crone, but the alleged mystic standing before you is something entirely different. The young woman who introduces herself as [eternal_life_mystic.GetFirstName] is a breath-taking beauty. Her voice is soft as lambs wool and her smile bright as a summer sun. You invite her to dine with you and her conversation is most intriguing. She claims to hold the secrets to eternal life and vitality and offers to teach you more, if you are willing to accept her quest.\n\nWhile it is impossible to know if this fair maiden speaks the truth, at least she seems very experienced for her tender age. But is she immortal...?;x
EVTDSC_RIP_21019_DIPLOMACY_B;You expected a wrinkled old crone, but the alleged mystic standing before you is something entirely different. Although she is very different compared to all the other women at court, no one can deny that her beauty is breath-taking. With a voice as soft as lambs wool and tinged with a foreign accent she introduces herself as [eternal_life_mystic.GetFirstName]. You invite her to dine with you and her conversation is most intriguing, if not outright controversial at times. She claims to hold the secrets to eternal life and vitality and offers to teach you more, if you are willing to accept her quest. \n\nWhile it is impossible to know if this fair maiden speaks the truth, at least she seems very experienced for her tender age. But is she immortal...?;x
EVTDSC_RIP_21019_INTRIGUE_A;The old woman introduces herself as [eternal_life_mystic.GetTitledFirstName] and proceeds to tell you about the noble art of alchemy. She claims to possess the secret knowledge of transmuting the base metals into gold and creating something she calls "alkahest". However, more importantly, she tells you tales of the mysterious Philosopher's Stone which grants its maker eternal life. If you accept her quest, she promises to share her secrets with you.\n\nWhile it is impossible to know if this alleged mystic tells the truth, at least she looks the part. Judging from her wrinkles and hunched back she must be very old. But is she immortal...?;x
EVTDSC_RIP_21019_INTRIGUE_B;The old, peculiar woman introduces herself as [eternal_life_mystic.GetTitledFirstName]. At least that is what you think she said - her words are distorted with a foreign accent. She claims to possess the secret knowledge of transmuting the base metals into gold, and more importantly, she tells you tales of the mysterious Philosopher's Stone. If you are to believe her words, it grants its maker eternal life. \n\nWhile you normally would not be inclined to trust a woman like this, her words do intrigue you. In any case she looks the part - judging from her wrinkles and hunched back she must be very old. But is she immortal...?;x
EVTDSC_RIP_21019_LEARNING_A;When you heard about the alleged mystic you pictured someone very youthful. However, you did not picture a child. \n\nThe little girl, who calls herself [eternal_life_mystic.GetFirstName], is unlike any child you have ever met. Her manners are incredibly mature and she seems to be far more knowledgeable than your most educated advisors. She tells you tales of faraway realms and distant times, heavy with symbolism and hidden meanings. While it is very strange to hear such wise words spoken by a mere child, the vividness of her stories makes you wonder if she experienced them all herself. She promises to tell you more if you accept her as a teacher.;x
EVTDSC_RIP_21019_LEARNING_B;When you heard about the alleged mystic you pictured someone very youthful. However, you did not picture a child. At first, you are inclined to laugh - who is this bizarre little girl? However, you can tell within minutes that [eternal_life_mystic.GetFirstName] is no ordinary child. Her somber manners are actually rather unsettling. \n\nShe tells you tales of faraway realms and distant times, heavy with symbolism and hidden meanings. While it is very strange to hear such words spoken by someone so young, the vividness of her stories makes you wonder if she experienced them all herself. She promises to tell you more if you accept her as a teacher.;x
EVTDSC_RIP_21019_MARTIAL_A;The tall figure offers you a nod, but does not smile. She eyes you skeptically, measuring you up as much as you are her. Her clothing is modest and her posture clearly that of a warrior's. "I am [eternal_life_mystic.GetTitledFirstName]. You are [Root.GetFirstName]," she says, as if somebody had forgotten to introduce you. Perhaps you should have spoken the first words, to assert your position, but the muscular woman makes you more than a little nervous. \n\n"I hear you are looking to live forever," she finally says, more a statement than question. "I can help.";x
EVTDSC_RIP_21019_MARTIAL_B;The tall figure offers you a nod, but does not smile. She eyes you skeptically, measuring you up as much as you are her. Her clothing, possibly intended to be modest, is foreign to you and you have trouble concealing your confusion. In fact, the warrior woman before you is bound to stand out in your court in more ways than one. "I am [eternal_life_mystic.GetTitledFirstName]. You are [Root.GetFirstName]," she says, as if somebody had forgotten to introduce you. Perhaps you should have spoken the first words, to assert your position, but the muscular woman makes you more than a little nervous.\n\n"I hear your are looking to live forever," she finally says, more a statement than question. "I can help.";x
EVTDSC_RIP_21099_OTHER_DEATH;As if fate is playing a cruel joke on me my guide to eternal life, [eternal_life_mystic.GetBestName], has passed on. Alone I try to walk the path she set me on, but without her helping hand I fumble in the dark... Is the path to immortality forever hidden from me now?;x
EVTDSC_RIP_21099_YOU_MURDERED;I try to walk the path to eternal life that [eternal_life_mystic.GetBestName] set me on without her help, but I am blind without her guidance. I cannot do anything but chuckle, my path to immortality has been severed by death caused by my own two hands – the irony!;x
EVTDSC_RIP_21100;[eternal_life_mystic.GetFirstName] tells you a tale about a hidden glade in which an ancient apple tree grows. The apples are the most delicious in the world, but more importantly, anyone who eats them become young anew. She offers to help you find the glade, but she also warns you that the search will not be easy and potentially very dangerous. \n\n[eternal_life_mystic.GetFirstName] urges you to form a fellowship of brave warriors to aid you in your quest. While you could just order some of your soldiers to tag along, she insists that they must follow you out of loyalty, not only by duty. She suggests that you arrange a grand feast and speak to them from your heart.;x
EVTDSC_RIP_21102;It is the night of your feast yet quite a few of those invited are missing. You grumble that you ought to have just ordered them to attend. [eternal_life_mystic.GetFirstName] soothingly pets your arm and assures you that you can still turn things around. \n\nHalfway through the dinner, you stand up to hold you speech. So far the night has been a failure and this fact does not exactly boost your confidence. Your listeners must notice this, because soon their gazes start to drift and they fidget uncomfortably in their seats. In the end you cannot stand it. You cut your speech short and bitterly order all your guests to leave. [eternal_life_mystic.GetFirstName] gives you one last disappointed look before leaving with the rest of them.;x
EVTDSC_RIP_21104;It is the night of your feast and warriors have come from far and wide. The word must have spread because there are far more guests than expected. Luckily, with [eternal_life_mystic.GetFirstName]'s help you manage to make room for everybody and after raiding the stores there is enough food and wine to go around. The music is jolly, the spirits are high and laughter echoes in your hall. \n\nHalfway through the dinner, you stand up to hold you speech. At first you are nervous, but when you see the fervor light up in the guests' eyes, your confidence rises. You deliver the best and most passionate speech of your life. By the end of it, the crowd stands up, howling and applauding. You look to your right where [eternal_life_mystic.GetFirstName] is seated– she is beaming at you. It seems like you have your fellowship.;x
EVTDSC_RIP_21110;Ever since [eternal_life_mystic.GetFirstName] announced that the time for the search was nigh you have been busy with preparations. The warriors are equipped, the provisions gathered and the best horses procured. Yesterday you finally set out on your quest. \n\n[eternal_life_mystic.GetFirstName] has led your fellowship deeper and deeper into the wilderness. The trail which you follow is barely visible in the thick underbrush, but [eternal_life_mystic.GetFirstName] seems certain this is the right path. The trail begins to slope upwards and within a few hours you are trudging up a narrow mountain path. The trail makes a sharp turn and as you pass it you spot an obstacle overhead. There has been a rockfall and boulders are blocking the path. [eternal_life_mystic.GetFirstName] insists that this trail is the only way forward.;x
EVTDSC_RIP_21112;You cannot do this without your fierce followers. However, they seem doubtful, so you attempt to raise their spirits and lead by example. You call out to draw their attention and proceed to inform them of your plan. While you do so, you pick a decently sized boulder and begin to shift it. At least you attempt to– however, it does not move an inch. Your companions do not seem convinced so you buckle down and really give it all you've got. Embarrassingly your efforts have no other outcome than a sweaty brow and scraped hands. You call for help but your breathless voice is less than inspiring.;x
EVTDSC_RIP_21114;You cannot do this without your fierce followers. However, they seem doubtful, so you attempt to raise their spirits with an inspirational speech. Your strong voice echoes in the mountain pass and yet again you can see the fire in your companions' eyes. They throw themselves into the task without hesitation and together you toil for many hours. Sweat and blood is your price but when dusk arrives, the path is cleared. Triumphantly [eternal_life_mystic.GetFirstName] grabs your hand and raises it above your heads. Your followers are exhausted, but this fact does not dampen their excited cheers. \n\nTomorrow your journey continues. While there is still some way to go, [eternal_life_mystic.GetFirstName] assures you that the path ahead will not cause you too much trouble.;x
EVTDSC_RIP_21116;You cannot do this without your fierce followers. However, they seem doubtful, so you attempt to raise their spirits and lead by example. You call out to draw their attention and proceed to inform them of your plan. By using your spear as a makeshift lever you attempt to shift the biggest of the boulders. It does move an inch, but before it starts to roll the spear snaps in your hand and the end smacks you right between the eyes. No one comes to your aid. Angered by their passive manners, you snatch the spear from the man standing closest to you and try again. Your temper makes you careless and before you know it, the ground shifts underneath your feet. The boulder plummets down into the ravine but so do you. The echoes of your terrified screams outlast your final breath.;x
EVTDSC_RIP_21120;After many months in the harsh wilderness you have finally reached the glade. Here, the breeze is warm and the sky clear, and the ground is covered in a sea of brightly colored flowers. In the midst of the clearing stands a great old tree, its branches reaching far higher than the surrounding canopy. [eternal_life_mystic.GetFirstName] points towards the top of the tree where you can see a single apple, shining red like a ruby in the afternoon sun. \n\nYou are about to enter the clearing when you hear a call from behind. It is one of your companions, a reserved fellow with whom you have only exchanged a few words. He questions why you should be the one to eat the apple when everyone has contributed equally on the journey. You can tell by the look on their faces that some of the others feel the same way...;x
EVTDSC_RIP_21122;Once the man is done speaking, you agree that the matter must be properly considered before a decision is made. You appoint the man to be the warriors' spokesperson and invite him to your tent for supper.\n\nWhen the two of you are alone, you make your offer. While you might not get the apple, he probably won't, either. A safer bet would be to support your claim in exchange for a heavy purse of coins. The man hesitates but then accepts.\n\nLater that evening when you argue your cause the man says you have got him convinced and supports your claim. All other opposition melts away. You walk up to the tree, [eternal_life_mystic.GetFirstName] at your side. "Congratulations, [Root.GetMasterMistress]," she murmurs with a smile. "Eternal life is finally yours.";x
