EVTDSC_RIP_21124;You courteously let the man finish, making a note of all his arguments. You then proceed to crush them, one by one, with the most eloquent speech of your life. You plead to their logic as well as to their hearts. Are you not the same [Root.GetManWoman] whom they pledged their loyalties to? Are you not their rightful and honorable liege? If you have their support, your gratefulness will be eternal. You will secure the future of their dynasties and their names will live on forever. By the end of your appeal there is a moment of absolute stillness and silence. Then the instigator kneels before you, tears in his eyes, and offers to bring you the apple himself. You have succeeded. \n\nIt is dusk when the man returns from the tree with the apple in his hand. "Congratulations, [Root.GetMasterMistress]," [eternal_life_mystic.GetFirstName] murmurs with a smile as you bite into the fruit. "Eternal life is finally yours.";x
EVTDSC_RIP_21125;Once the man is done speaking, you agree that the matter must be properly considered before a decision is made. You appoint the man to be the warriors' spokesperson and invite him to your tent for supper. When the two of you are alone, you make your offer. His support for your claim in exchange for a heavy purse of coins. The man hesitates but then accepts. \n\nLater that evening you argue your cause. When you have finished your speech, you expectantly turn towards the man. The words that come out of his mouth are not the ones you expected, however. He exposes your attempt to bribe him and fires up the others. You start to run for the tree but the angry mob catches up within moments.;x
EVTDSC_RIP_21126;You interrupt the instigator. Are you not the same [Root.GetManWoman] whom they gladly pledged their loyalties to? Are you not their rightful and honored liege? When you finish your appeal there is a moment of silence. Then the instigator nods slowly and agrees to fetch you the apple himself. Relieved, you thank him. This could have ended badly! \n\nYou nervously watch from below as the man climbs the tree. It is very tall and on more than one occasion he looks perilously close to falling. When he finally reaches the top of the tree, you shout in triumph, but your happiness is soon thwarted – with a defiant look, the man sinks his teeth into the apple himself. You glance at [eternal_life_mystic.GetFirstName], panic in your eyes, but she only shakes her head wistfully. It is over.;x
EVTDSC_RIP_21200;[eternal_life_mystic.GetTitledFirstName] sits on the floor when you enter the room, what looks like polished pieces of bone strewn out in front of her. She motions for you to join her. "You have neglected your spirit" she says, eyes closed. You shift uncomfortably in your seat. "I have not" you mumble. Her eyes open at this and she stares at you, a steely cold look and you retract your statement. "You must sacrifice" she declares. "Very well" you reply, thinking you'll have your learned [Root.job_spiritual.GetTitledFirstName] see to it. As if she could read your mind [eternal_life_mystic.GetFirstName] shakes her head: "You must do this on your own. Do you see what I see?" \n\nYou notice a pattern in the bones. It looks just like...;x
EVTDSC_RIP_21202_A;All was well until you tried placing the animal on the ceremonial stone slab and you were surprised at its strength. It moves wildly under your hands, refusing to have its neck pressed to the rock. "I don't want to do this," you think for a brief moment, as a sharp dagger is handed to you. [eternal_life_mystic.GetTitledFirstName] watches you intently, her stern face void of motion, and you find yourself wondering if she possesses any feelings at all or if she carries herself by duty alone?\n\nSuddenly pain shoots through your arm, as the flailing antelope bites down hard on your hand. [eternal_life_mystic.GetFirstName] reacts instantly and swings her sword at the creature, chopping its head right off, but your fingers are already gone. There is blood EVERYWHERE.;x
EVTDSC_RIP_21202_B;You anxiously carry the torch to the altar, where three full barrels of grain stand neatly together. [eternal_life_mystic.GetTitledFirstName] watches you intently, her stern face void of motion, and you find yourself wondering if she possesses any feelings at all, or if she carries herself by duty alone? Such a straight back. Such discipline! You can see why she would inspire respect and the thought makes you nervous. \n\nThe momentary distraction causes you to lose focus and you realize that the flames are now licking on your sleeves, spreading quickly up your arm. [eternal_life_mystic.GetFirstName] reacts almost instantly, throwing her cloak around you, but the fire won't go out! You are screaming, the pain too much to bear.;x
EVTDSC_RIP_21204_A;[eternal_life_mystic.GetTitledFirstName] hands you a beautiful dagger. The antelope, held down on a stone slab, is surprisingly calm. "Thank you" you say quietly to the animal - you hesitate only a second before slicing its throat. The blood pours down the altar and [eternal_life_mystic.GetFirstName] nods solemnly. Your heart flutters at the notion of having pleased the statuesque character. \n\n"Your grandfathers and mothers would be proud" [eternal_life_mystic.GetFirstName] announces.;x
EVTDSC_RIP_21204_B;[eternal_life_mystic.GetTitledFirstName] hands you the torch. Placed carefully next to each other three barrels, filled to the brim with fine grain, await your approach. [eternal_life_mystic.GetFirstName] nods at you from the altar and starts chanting something, using words you have never heard before. You step up to the altar and lower the torch to one of the barrels, to let the flames have their way. \n\n[eternal_life_mystic.GetFirstName] eventually stops speaking and she looks at you, approval, albeit faint, definitely readable on her face. You smile broadly. \n\n"Your grandfathers and mothers would approve of this" [eternal_life_mystic.GetSheHe] says.;x
EVTDSC_RIP_21210;[eternal_life_mystic.GetFirstName] knocks on your door one evening, carrying a large ceramic jar, animal motifs and ornaments encircling it. Puzzled, you invite her in and pull out two chairs. "Student [Root.GetFirstName], I am pleased with the sacrifice you performed," she says, sitting down on the floor. She places the jar in front of her. "Your ancestors are surely appeased, but I thought it would be a good time to prove to them your strength further."\n\nAs she removes the lid from the jar you hear a hissing noise. A large snake spring launches at you and you are left to your instincts!;x
EVTDSC_RIP_21212;Before you have even time to react the snake bares its fangs. Heading straight for you, seemingly flying, it bites you in your neck. The creature hisses, slithers around you and begins to move upwards. "Nooo, not the face!" you yell, flailing your arms wildly. "[eternal_life_mystic.GetFirstName], help me!"\n\nAfter what seems like an eternity [eternal_life_mystic.GetFirstName] rises from her spot and steps in to grab the snake by its neck, her voice soothing it as it obediently pours back into the jar.;x
EVTDSC_RIP_21214_A;[eternal_life_mystic.GetFirstName]'s eyes widen as you, with the speed of a heron, reach out and grab the snake by its neck. The creature writhes in your hand and you proceed to slam it against a table, hard. In a state of panic you repeat the action several times before you hear [eternal_life_mystic.GetFirstName]'s steady voice getting through to you: "[Root.GetMasterMistressCap]. The soul is gone. You can let it go... You did good."\n\nThe snake is limp in your hold. Your palms are sweaty.;x
EVTDSC_RIP_21214_B;[eternal_life_mystic.GetFirstName] sits calmly as you quickly, but not quite gracefully, grab the heavy tome and slam it uncomfortably hard into the side of the snake. The creature bounces off to the other end of the room where you follow it, frantically stomping on the floor while the animal wriggles around your feet. When it stops you are panting, and you look around to see [eternal_life_mystic.GetFirstName] looking at you, motionlessly. \n\n "It wasn't venomous, was it?" you frown. \n"Not at all," she replies, a smile tugging at the corner of her mouth.;x
EVTDSC_RIP_21216;Before you have even time to react the snake bares its fangs. Heading straight for you, seemingly flying, it bites you in your neck. The creature hisses, slithers around you and moves upwards. "Nooo, not the face!" you yell, flailing your arms wildly. "[eternal_life_mystic.GetFirstName], help me!"\n\nAfter what seems like an eternity [eternal_life_mystic.GetFirstName] rises from her spot and steps in to grab the snake by its neck, her voice soothing it as it obediently pours back into the jar.;x #same as 21212?
EVTDSC_RIP_21220;When you after a long wait are summoned to [eternal_life_mystic.GetFirstName]'s chambers again you are excited. What mystical challenge lies ahead of you this time? There's a spring in your step as you enter to find her standing like a statue - head bowed, hands holding something to you. Sometimes you wonder what she does when you're not around. Does she even move?\n"What's this?" you ask.\n"Magic," she says naturally. "The time has come for your spirit to choose its next vessel. No, don't be afraid! The breath of life within you is powerful enough to be passed on. You should be proud." \nShe hands you a waterskin and motions to the floor. Then she begins to hum - it is both melodic and eerie.;x
EVTDSC_RIP_21222;You are floating in space. When you turn around it feels as though you are moving under water and you can't seem to make a sound. There is a melody in your head that you can't quite wrap your head around - it is both soothing and frustrating. It is pulling at you, drawing you in. Suddenly you are moving at incredible speed! Just as you are trying to catch a glimpse of the little spot of light you are shooting towards, you realize it is you, yourself, lying on the floor. [eternal_life_mystic.GetFirstName] leans over you, trying to wake you. \n\nYou crash into your own body and the first breath you draw feels magnificent. "The seed of life is in you still. And I don't think you're the only one in there any more", [eternal_life_mystic.GetFirstName] says contentedly.;x
EVTDSC_RIP_21224;The floor is hard, and the words chanted by [eternal_life_mystic.GetFirstName] make no sense to you. It is a language you do not understand and the melody has no pattern to it. Your eyes closed, you grow a little irritated by the whole situation. Maybe it is natural to move on to the next realm, who are you to stop it? Who is [eternal_life_mystic.GetFirstName] to have you go through these trials?\n\n"It's happening!" [eternal_life_mystic.GetFirstName] exclaims suddenly, and you feel like you exploded, like you are sucked into space, then thrown back into your body again, all within the blink of an eye. When you sit up, bewildered, the mystic smiles at you.\n\n"You're hosting your grandfathers in your body. They will keep you alive, for many days to come" she says.;x
EVTDSC_RIP_21226;[eternal_life_mystic.GetFirstName]'s chanting grows faint as you find yourself floating upwards, looking down at your own body. The room has a strange purple hue to it, as if twilight had fallen. Yet it shouldn't have? The mystic leans in over your body, touching your forehead, and she speaks but you can't make out what she is saying. You struggle to move closer to her through the air, but you feel like you are under water, your limbs heavy, your movement slowed to a crawl. You try to call her attention by screaming, but no sound comes out. Suddenly she turns around, not seeing you, but sensing your presence. She moves her hand through the air where you hang and smiles. You can barely make out the words she says: "You are a brave warrior, [Root.GetTitledFirstName], and your spirit is strong. I hope we meet again.";x
EVTDSC_RIP_21227;The chanting quickly begins to feel repetitive. You try to relax, but something doesn't feel right. Who are you play at things like life and death? You just want to be left alone! Sometimes you even wonder whether you're a good ruler or not, and how can one know? \n\nYou feel the warrior mystic placing a hand on your sweaty forehead. Her skin is cool to the touch and you are suddenly grateful. Maybe this is not so bad after all? Then you hear someone talking excitedly. You are overcome with an urge to hush them as they are disturbing the ritual. Then you hear more voices. Your eyes still closed you start to twist and turn, and a convulsing nausea takes you over. "Oh, no," you hear [eternal_life_mystic.GetFirstName] utter worriedly before the voices start screaming...;x
EVTDSC_RIP_21300;[eternal_life_mystic.GetTitledFirstName] explains that you need to obtain the ingredients known as the Three Primes, the first of which is salt. When you offer to send a servant to the kitchen, she protests. "The art of alchemy is not simply one of collecting ingredients and mixing potions. In order to create the Philosopher's Stone, you must also create a better self." \n\nThe old crone insist that you must conquer your body by mastering the art of pickpocketing. Being of noble birth, you have never needed to resort to such methods, but you do pride yourself on being deft of hand. It cannot be that hard, can it?;x
EVTDSC_RIP_21302;The day of the first trial has arrived. You have dressed yourself as a lowly commoner and left your guards behind. It is a strange feeling, walking through the crowded market as if you were no one special. Instead of giving way, people walk right into you and spit curses as you stumble. You are starting to feel uneasy and decide to hurry up and get it over with.\n\nHowever, your nerves seem to have gotten the better of you and you make a dreadful mess of your attempt. Within seconds, the spice merchant's guards are pressing your face into the ground. "Don't hurt me! I am [Root.GetBestName]!" you shout in panic. "Yes, and I am [Root.Religion.GetHighGodName]," the merchant scoffs and turns to his guards. "Show this dreg what we do with thieves.";x
EVTDSC_RIP_21304;The day of the first trial has arrived. You have dressed yourself as a lowly commoner and left your guards behind. It is a strange feeling, walking through the crowded market as if you were no one special. No one is looking your way and your confidence is growing. However, you decide to take your time. There is no need to rush. \n\nYour patience pays off when you are presented with the perfect opportunity to slip your hand into the spice merchant's pocket. Before you know it, you are on your way back to the keep with the stolen salt in your pouch, and nobody saw a thing. You are really getting the hang of this! On your return the otherwise grouchy [eternal_life_mystic.GetFirstName] greets you with a pleased smirk. "You did well. Rest now, my [Root.GetLordLady]. The next trial will not be as easy.";x
EVTDSC_RIP_21310;You almost jump out of your skin when [eternal_life_mystic.GetFirstName] suddenly steps out from behind a corner. "Heading to bed already, my [Root.GetLordLady]? The night has only begun." Apparently it is time for your next trial and this time you must acquire brimstone. "This one is a trial of the mind, [Root.GetMasterMistress]. You must go to the laboratory and produce the Prime yourself. You have until dawn." Before she disappears again, she hands you a dusty tome. \n\nYou spend several hours desperately trying to make sense of the tome's archaic language. The text seems to mention two different methods– one of which looks very complicated, however the simpler one runs the risk of producing a violent explosion...;x
EVTDSC_RIP_21312;You keep staring at the tome's pages for another couple hours, but your mind is hazy with sleep and the letters only dance before your eyes. The candle is burning low and dawn is fast approaching. You must make your attempt now– it is better to fail than to never grasp the opportunity at all. \n\nYou assemble what you think are the proper instruments and get started. The outcome of each step does not at all match the descriptions in the book but you hope for the best and keep going. However, when the first rays of morning light fall through the window you have succeeded with nothing except filling the laboratory with a putrid smell. When [eternal_life_mystic.GetFirstName] enters, she only gives you a displeased look, half disappointment and half disgust.;x
EVTDSC_RIP_21314;Despite the late hour, your mind feels as sharp as a razor. While the tome's language troubled you at first, you now feel confident that you have interpreted every detail correctly. The method makes perfect sense and you barely have to glance at the instructions when you assemble all the instruments and ingredients. \n\nAfter each step, the outcome is identical to the one described in the tome. Your confidence is rising– you are almost there! However, you make sure that your high spirits do not get the better of you, and proceed at a steady pace. When [eternal_life_mystic.GetFirstName] enters at dawn, you present her with vial filled with yellow shards. "Well done, [Root.GetMasterMistress]!" she exclaims with one of her rare smiles. "Only one Prime left!";x
EVTDSC_RIP_21316;You cannot endure the thought of doing nothing but waiting for your impending demise. Life is short and only immortality can grant you peace of mind. You are certain that you grasped all the details of your chosen method– all you need now is a steady hand. \n\nAfter each step, the outcome is identical to the one described in the tome. Your confidence is rising– you are almost there! Your high spirits make you move swifter, but you do not notice. Not until it is too late. At the very last step, you slip and drop the vial in your hand. You do not even have time to flinch before you are engulfed in the roaring flames.;x
EVTDSC_RIP_21320;The third and most elusive of the Three Primes is the metal known as quicksilver, [eternal_life_mystic.GetFirstName] announced as she entered your study this morning. Now it is dusk, and she has brought you far from civilization to an abandoned mine. "Here you will perform the last and most dangerous trial, my [Root.GetLordLady]. You will spend the night in this haunted place. If you exit with a piece of quicksilver ore, you have succeeded, and eternal life will be yours. However, if you fail, the ghosts of the past will likely drive you mad– or worse." \n\nYou have wandered the narrow tunnels for almost an hour when a spine-chilling wail echo from the darkness. You freeze– is this one of the ghosts [eternal_life_mystic.GetFirstName] mentioned?;x
EVTDSC_RIP_21322;You hesitantly call out for the ghost. At first, nothing happens, and you think you must have been mistaken. Then suddenly an ear-deafening roar breaks the silence. You turn on your heel and run for your life, but stumble almost instantly. As the roar grows louder you fear that this is the end, but a rush of wind passes by above your head and then everything is silent. When you get back up, you spot the rock you tripped over. A crimson piece of mercury ore! \n\nYou raise the rock triumphantly above your head as you step into the daylight. [eternal_life_mystic.GetFirstName] greets you with a pleased laugh. "Excellent, [Root.GetMasterMistress]. Tonight, we will create the Philosopher's Stone, and immortality will be yours.";x
EVTDSC_RIP_21324;Quietly you walk back to the last intersection and continue your search down another tunnel. How much time has passed? Hours or days, it is impossible to tell. Your own breath has grown so loud in your ears and you keep seeing the same rock formations over and over again... When you trip on a rock you just lay there for a few minutes, contemplating surrender. However, when you do get up, you spot the rock you tripped over. A crimson piece of mercury ore! \n\nYou raise the rock triumphantly above your head as you step into the daylight. [eternal_life_mystic.GetFirstName] greets you with a pleased laugh. "Excellent, [Root.GetMasterMistress]. Tonight, we will create the Philosopher's Stone, and immortality will be yours.";x
EVTDSC_RIP_21325;You stumble down the dark corridor and hesitantly call out for the ghost. You instantly regret your decision as you are answered with an ear-deafening roar. It is followed by a gust of wind which extinguishes your torch. You turn on your heel and run for your life, but trip after only a few steps. A taste of blood fills your mouth and the roar grows louder, shaking you to your very core. There is no point trying to get up. You close your eyes and await your doom.;x
EVTDSC_RIP_21326;Quietly you walk back to the last intersection and continue your search down another tunnel. How much time has passed? Hours or days, it is impossible to tell. Your own breath has grown so loud in your ears and you keep seeing the same rock formations over and over again... As your limbs grow weaker, your panic increases in strength, and soon you are shouting for help. Your own words echo back at you, warped by the tunnels. Are they even yours? You can no longer recognize them... You wander the tunnels, howling and weeping, until your knees buckle and you fall unconscious. \n\nAfter what feels like an eternity, you feel soft rain on your face. You have no idea how you made it out.;x
EVTDSC_RIP_21400_A;[eternal_life_mystic.GetFirstName] and you are walking side by side through the capital as she patiently explains the principles of reincarnation and immortality. "[Root.GetFirstName], my friend. Remember that Karma is not only produced when you act. Everything you think, say and cause is also Karma. While good deeds yield sweet fruits, Punya, unkindness brings forth spoiled fruits, Paap." \n\nYour walk has brought you to a rundown alley where a man in tattered clothes sleeps in a doorway. As you approach, the stench of alcohol and vomit becomes unbearable. [eternal_life_mystic.GetFirstName] tells you that the man was cheated of all his savings and how he fell into despair when the local authorities refused to help him. The tale fills you with compassion for the poor fellow.;x
EVTDSC_RIP_21400_B;[eternal_life_mystic.GetFirstName] and you are walking side by side through the capital as she patiently explains the principles of reincarnation and immortality. "[Root.GetFirstName], my friend. Remember that Karma is not only produced when you act. Everything you think, say and cause is also Karma. While good deeds yield sweet fruits, Punya, unkindness brings forth spoiled fruits, Paap." \n\nYour walk has brought you to a rundown alley where a man in tattered clothes sleeps in a doorway. As you approach, the stench of alcohol and vomit becomes unbearable. [eternal_life_mystic.GetFirstName] tells you that the man was cheated of all his savings and how he fell into despair when the local authorities refused to help him. It seems like [eternal_life_mystic.GetFirstName] want you to pity him but you cannot force yourself to do so.;x
EVTDSC_RIP_21402_A;[eternal_life_mystic.GetFirstName] folds her arms over her chest and frowns. If she was just any child you would have laughed, but [eternal_life_mystic.GetFirstName]'s disapproval fills you with worry. Did you not do the right thing? \n\n"I see now that I was mistaken on your account, [Root.GetFirstName]. While it is easy to say the good word and do the good deed, I can tell that you are not thinking the good thought. You do not truly care about this man. Before you can grow, you must be honest with your failings. I am afraid you are not ready to embrace my teachings.";x
EVTDSC_RIP_21402_B;[eternal_life_mystic.GetFirstName] folds her arms over her chest and frowns. If she was just any child you would have laughed, but [eternal_life_mystic.GetFirstName] looks quite menacing. \n\n"What did I just tell you about Karma and the spoiled fruit of bad actions? It will only come back and punish you, [Root.GetFirstName]. I am afraid you are not ready to embrace my teachings.";x
EVTDSC_RIP_21404_A;[eternal_life_mystic.GetFirstName] nods contentedly as you kneel next to the man and offer him your coin purse. "The fruit of good thoughts and good deeds is sweet indeed, my friend. Acts of kindness brings peace to your heart and brings you one step closer to enlightenment. You are a just ruler, indeed." \n\nDuring the walk home, your heart does feel lighter. You intently listen to [eternal_life_mystic.GetFirstName]'s thoughtful musings, trying to remember every word. She might be the true saint you have been waiting for.;x
EVTDSC_RIP_21404_B;[eternal_life_mystic.GetFirstName] nods contentedly at your words. "Most people understand the value of compassion and a good deed, but few understand the true meaning of honesty. Before we can grow, we must learn to accept our failings. You have taken the first step on the journey." \n\n[eternal_life_mystic.GetFirstName]'s words really resonate with you and during the walk home you intently listen to her lesson. You soak up every word and decide to make a change in your life. If you have taken the first step, surely taking the next will be easier.;x
